ticker,date,publishedAt,source,title
TSLA,2025-04-24,2025-04-24T23:47:45Z,Business Insider,CEOs can't stop saying these 4 words on earnings calls
TSLA,2025-04-24,2025-04-24T23:33:43Z,Biztoc.com,"Elon Musk's ""Robotaxis"" Have a Dirty Secret"
TSLA,2025-04-24,2025-04-24T23:33:36Z,Biztoc.com,Tesla’s Adjusted Earnings Got 12% Bump From Omitting Crypto Loss
TSLA,2025-04-24,2025-04-24T23:28:19Z,Fox Sports,"USC commit Alijah Arenas, son of Gilbert Arenas, in coma following car crash"
TSLA,2025-04-24,2025-04-24T23:23:12Z,Energycentral.com,Times will Get Even Tougher for Tesla
TSLA,2025-04-24,2025-04-24T23:18:21Z,BBC News,Who will win the race to develop a humanoid robot?
TSLA,2025-04-24,2025-04-24T23:05:13Z,Yahoo Entertainment,USC basketball recruit Alijah Arenas injured in LA car crash
TSLA,2025-04-24,2025-04-24T23:02:52Z,CNBC,Jim Cramer credits this week's rally to earnings and restraint from the White House
TSLA,2025-04-24,2025-04-24T23:00:00Z,The Daily Dot,‘But it’s a Honda no way’: Veteran NYC mechanic puts Honda Pilot on lift. Then he discovers the real reason it’s rattling
TSLA,2025-04-24,2025-04-24T22:45:00Z,Twit.tv,"TNW 384: Mark Zuckerberg's Instagram Envy - Tesla Robotaxis, Apple Intelligence, Razr"
TSLA,2025-04-24,2025-04-24T22:37:10Z,NBCSports.com,"Alijah Arenas, a five-star recruit committed to USC next season, in coma after car accident"
TSLA,2025-04-24,2025-04-24T22:34:10Z,Wired,"In a Boon for Tesla, Feds Weaken Rules for Reporting on Self-Driving"
TSLA,2025-04-24,2025-04-24T22:29:41Z,New York Post,Tesla launches test run for full self-driving Supervised — an AI-powered ride hailing service
TSLA,2025-04-24,2025-04-24T22:28:01Z,Business Insider,Ex-DoD official warns trying to make the Pentagon run like a business could backfire
TSLA,2025-04-24,2025-04-24T22:27:19Z,Biztoc.com,"State officials and pension-affiliated stakeholders remain concerned about Tesla, even with Musk's pledge to step back from DOGE"
TSLA,2025-04-24,2025-04-24T22:26:00Z,CBS News,USC recruit Alijah Arenas put into coma after Cybertruck crash in L.A.
TSLA,2025-04-24,2025-04-24T22:23:55Z,Business Insider,"State officials and pension-affiliated stakeholders remain concerned about Tesla, even with Musk's pledge to step back from DOGE"
TSLA,2025-04-24,2025-04-24T22:17:00Z,The Star Online,U.S. stocks extend gains amid rate cut hope
TSLA,2025-04-24,2025-04-24T22:15:11Z,Mediaite,‘I’ll Hook You up to a F*****g Polygraph!’ Hegseth Reportedly ERUPTED at Joint Chiefs Chairman He Suspected of Leaking To the Press
TSLA,2025-04-24,2025-04-24T22:05:10Z,CNBC,"Waymo reports 250,000 paid robotaxi rides per week in U.S."
TSLA,2025-04-24,2025-04-24T22:00:00Z,OilPrice.com,China’s Energy Storage Giants Face a Hard Reset
TSLA,2025-04-24,2025-04-24T22:00:00Z,Drive.com.au,Jeff Bezos-backed electric start-up shows off Land Rover-like SUV
TSLA,2025-04-24,2025-04-24T21:47:35Z,Japan Today,China's fast-growing EV makers pursuing varied routes to global expansion
TSLA,2025-04-24,2025-04-24T21:47:26Z,Japan Today,Nissan revises down its earnings forecast with bigger losses
TSLA,2025-04-24,2025-04-24T21:45:12Z,HuffPost,USC Basketball Recruit Alijah Arenas Reportedly In Coma After Serious Car Crash
TSLA,2025-04-24,2025-04-24T21:40:49Z,Rolling Stone,Trump’s Top D.C. Prosecutor Apologizes for Lauding Nazi Sympathizer as ‘Extraordinary Man’
TSLA,2025-04-24,2025-04-24T21:38:25Z,Electrek,"Tesla is starting to have Model Y inventory in the US again, ramps up incentives in China/Europe"
TSLA,2025-04-24,2025-04-24T21:36:42Z,TMZ,"Alijah Arenas Car Crash Video Shows Fiery Wreck, Star Writhing On Ground"
TSLA,2025-04-24,2025-04-24T21:31:42Z,Biztoc.com,How much was Elon Musk’s pledge to step back from DOGE worth? $67 billion to frustrated Tesla shareholders
TSLA,2025-04-24,2025-04-24T21:24:58Z,Chrbutler.com,You Can Be a Great Designer and Be Completely Unknown
TSLA,2025-04-24,2025-04-24T21:19:58Z,Yahoo Entertainment,How much was Elon Musk’s pledge to step back from DOGE worth? $67 billion to frustrated Tesla shareholders
TSLA,2025-04-24,2025-04-24T21:15:23Z,The Hollywood Gossip,Alijah Arenas: Teen Son of Gilbert Arenas In Coma Following Car Accident
TSLA,2025-04-24,2025-04-24T21:03:52Z,New York Post,Sleeping Long Island teen busted for DUI after driving Tesla down Connecticut highway on autopilot: ‘Just dangerous’
TSLA,2025-04-24,2025-04-24T21:03:50Z,TODAY,"Alijah Arenas, top USC recruit and son of retired NBA player Gilbert Arenas, hospitalized after crash"
TSLA,2025-04-24,2025-04-24T21:02:04Z,Babylonbee.com,Ignorant Kids Have No Idea How Cool Dad Is
TSLA,2025-04-24,2025-04-24T20:48:00Z,Biztoc.com,Elon Musk claims Tesla is the top robot company but worries that Nos. 2 through 10 will be Chinese
TSLA,2025-04-24,2025-04-24T20:45:57Z,NBC News,"Alijah Arenas, top USC recruit and son of NBA great Gilbert Arenas, hospitalized after crash"
TSLA,2025-04-24,2025-04-24T20:45:46Z,Babylonbee.com,Neil DeGrasse Tyson Debunks 12 Popular Song Lyrics
TSLA,2025-04-24,2025-04-24T20:43:57Z,Fox News,"Alijah Arenas, son of ex-NBA star Gilbert Arenas, in induced coma after serious vehicle crash: reports"
TSLA,2025-04-24,2025-04-24T20:40:28Z,CBS Sports,"USC commit Alijah Arenas, son of Gilbert Arenas, in 'stable' condition following car accident, per report"
TSLA,2025-04-24,2025-04-24T20:40:27Z,Babylonbee.com,Sad: This Guy Spent $500k On Ivy League Education And All He Knows How To Do Is Chant ‘Free Palestine’
TSLA,2025-04-24,2025-04-24T20:37:07Z,Futurism,Elon Musk's DOGE Has Been a Dismal Failure
TSLA,2025-04-24,2025-04-24T20:34:18Z,The Verge,Trump goes after websites that raise money for his enemies
TSLA,2025-04-24,2025-04-24T20:33:36Z,The New Yorker,The Guerrilla Marketing Campaign Against Elon Musk
TSLA,2025-04-24,2025-04-24T20:26:17Z,CBS Sports,"USC commit Alijah Arenas, son of Gilbert Arenas, in critical condition following car accident, per report"
TSLA,2025-04-24,2025-04-24T20:21:51Z,Yahoo Entertainment,Top basketball prospect Alijah Arenas reportedly in coma after car crash
TSLA,2025-04-24,2025-04-24T20:21:35Z,Wnd.com,Prosecutor says charging Tim Walz official for Tesla vandalism would risk ‘public safety’
TSLA,2025-04-24,2025-04-24T20:06:45Z,Forbes,Google Earnings Stock Soars As Q1 Results Shatter Expectations
TSLA,2025-04-24,2025-04-24T20:06:27Z,Daily Signal,6 Things to Know About the Judge Blocking Trump’s Election Integrity Order
TSLA,2025-04-24,2025-04-24T20:02:41Z,Hollywood Life,Gilbert Arenas’ Son: What We Know About Alijah Arenas Amid His Coma
TSLA,2025-04-24,2025-04-24T20:00:31Z,Forbes,5 Top Stocks To Buy Now For May 2025
TSLA,2025-04-24,2025-04-24T20:00:00Z,Robb Report,Cadillac Is Making a Compact All-Electric Performance SUV
TSLA,2025-04-24,2025-04-24T19:54:45Z,The Verge,"The $20,000 American-made electric pickup with no paint, no stereo, and no touchscreen"
TSLA,2025-04-24,2025-04-24T19:50:50Z,The Verge,Trump updates Biden’s robo-car crash reporting rule to benefit Tesla
TSLA,2025-04-24,2025-04-24T19:47:25Z,The Daily Dot,Pardoned Jan. 6ers are losing patience with the FBI
TSLA,2025-04-24,2025-04-24T19:40:21Z,Jalopnik,Five-Star Basketball Prospect Severely Injured In Fiery Tesla Cybertruck Crash
TSLA,2025-04-24,2025-04-24T19:33:24Z,Rivals.com,REPORT: Five-star USC commit Alijah Arenas in serious car accident
TSLA,2025-04-24,2025-04-24T19:27:46Z,redmondpie.com,Tesla’s ‘FSD Supervised’ Tests Are Now Live In Austin And The Bay Area
TSLA,2025-04-24,2025-04-24T19:27:31Z,Forbes,CarMax's EV Trends Report Shows EV Searches Nearly Doubled In The Past Three Years
TSLA,2025-04-24,2025-04-24T19:25:30Z,Livemint,Hedge Funds Seek Out Ways to Navigate Trump’s Anti-Climate Agenda
TSLA,2025-04-24,2025-04-24T19:19:40Z,Futurism,Elon Musk Has a Huge Problem With His Republican Fans: They're Ditching Their Teslas
TSLA,2025-04-24,2025-04-24T19:19:24Z,The Times of India,Change on cards for EV manufacturing policy
TSLA,2025-04-24,2025-04-24T19:16:37Z,CNN,How Trump altered the government in ways that could benefit himself and his inner circle
TSLA,2025-04-24,2025-04-24T19:14:14Z,USA Today,Tesla’s fight for survival: Why Americans are abandoning the brand and Elon Musk
TSLA,2025-04-24,2025-04-24T19:07:07Z,Babylonbee.com,"'You're Going To Make It,' Says TV ER Doctor To Patient Who's Definitely Going To Die At The End Of The Episode"
TSLA,2025-04-24,2025-04-24T19:04:24Z,PEOPLE,"Gilbert Arenas' Son Alijah, 18, in Medically Induced Coma After Car Accident"
TSLA,2025-04-24,2025-04-24T19:03:10Z,New York Post,"Alijah Arenas, son of ex-NBA star Gilbert and USC commit, put into coma after car crash"
TSLA,2025-04-24,2025-04-24T18:56:49Z,Biztoc.com,The market keeps proving itself as the biggest foil for Trump and Musk
TSLA,2025-04-24,2025-04-24T18:47:32Z,Decrypt,Elon Musk: Tesla to Launch Robotaxi Service in Austin by June
TSLA,2025-04-24,2025-04-24T18:44:59Z,Fox Sports,Gilbert Arenas' son and USC commit Alijah Arenas reportedly in coma following car crash
TSLA,2025-04-24,2025-04-24T18:44:05Z,Arizona Daily Star,"Musk to focus more on Tesla brand damage, less on DOGE"
TSLA,2025-04-24,2025-04-24T18:41:38Z,The Verge,Now Kia EVs can use Tesla’s Superchargers
TSLA,2025-04-24,2025-04-24T18:40:22Z,NPR,More than 50 House Democrats demand answers after whistleblower report on DOGE
TSLA,2025-04-24,2025-04-24T18:39:24Z,Yahoo Entertainment,Elon Musk's Wealth Skyrockets By Billions As Tesla Stock Rallies After Billionaire CEO Steps Back From DOGE
TSLA,2025-04-24,2025-04-24T18:33:01Z,Slashdot.org,"Tariff turmoil: What P&G, Pepsi and other companies are saying about tariffs - AP News"
TSLA,2025-04-24,2025-04-24T18:30:28Z,TMZ,"Alijah Arenas, Gilbert's Son, Seriously Injured In Car Crash, Placed Into Induced Coma"
TSLA,2025-04-24,2025-04-24T18:25:46Z,@tucson_police,Alijah Arenas Hospitalized In Induced Coma After Serious Car Accident
TSLA,2025-04-24,2025-04-24T18:23:21Z,Biztoc.com,Ditching DOGE? Why Elon Musk Is Returning to the Driver’s Seat at Tesla
TSLA,2025-04-24,2025-04-24T18:23:19Z,Biztoc.com,Is Tesla Stock A Buy Or A Sell With Elon Musk Stepping Back From The Trump White House?
TSLA,2025-04-24,2025-04-24T18:21:21Z,Breitbart News,'Two-Tier Justice:' Soros-Backed Minnesota Prosecutor Mary Moriarty Slammed for Not Filing Charges Against Tesla Vandal
TSLA,2025-04-24,2025-04-24T18:13:01Z,Slashdot.org,Elon Musk Pretends He’s Leaving The Job He Supposedly Doesn’t Have To Not Return To The Job He Supposedly Never Left
TSLA,2025-04-24,2025-04-24T18:12:10Z,Jalopnik,Half Of Americans Hold Negative Opinions Of Tesla And Elon Musk
TSLA,2025-04-24,2025-04-24T18:12:10Z,New York Magazine,Is Elon Musk Sinking Tesla or Keeping It Afloat?
TSLA,2025-04-24,2025-04-24T18:03:35Z,Techdirt,Elon Musk Pretends He’s Leaving The Job He Supposedly Doesn’t Have To Not Return To The Job He Supposedly Never Left
TSLA,2025-04-24,2025-04-24T18:00:00Z,Electrek,"Jackery cuts Explorer 5000 Plus offers to new lows from $2,483, Lectric XP 3.0 e-bike bundles up to $365 off, Anker SOLIX C1000, more"
TSLA,2025-04-24,2025-04-24T17:43:49Z,Mediaite,‘Outright Evidence of Corruption’: Senate Dem Calls for Investigation Into Trump’s ‘Private Dinner’ With Meme Coin Holders
TSLA,2025-04-24,2025-04-24T17:41:19Z,Securityaffairs.com,Yale New Haven Health (YNHHS) data breach impacted 5.5 million patients
TSLA,2025-04-24,2025-04-24T17:38:24Z,Biztoc.com,Tesla To $450? Here Are 10 Top Analyst Forecasts For Thursday
TSLA,2025-04-24,2025-04-24T17:30:00Z,Richmond.com,Musk damaged Tesla's brand in just a few months. Fixing it will likely take longer
TSLA,2025-04-24,2025-04-24T17:30:00Z,Roanoke Times,Musk damaged Tesla's brand in just a few months. Fixing it will likely take longer
TSLA,2025-04-24,2025-04-24T17:29:24Z,The Times of India,"Too little, too late: Wall Street traders say Elon Musk’s return to Tesla won’t reverse the damage already done"
TSLA,2025-04-24,2025-04-24T17:28:01Z,Biztoc.com,"Stocks to Watch Thursday: P&G, IBM, Merck, ServiceNow"
TSLA,2025-04-24,2025-04-24T17:27:42Z,Biztoc.com,"These Stocks Are Moving the Most Today: Tesla, IBM, ServiceNow, Texas Instruments, Newmont, Southwest Airlines, and More"
TSLA,2025-04-24,2025-04-24T17:27:21Z,Wired,'Who Is Doge?' Has Become a Metaphysical Question
TSLA,2025-04-24,2025-04-24T17:25:00Z,Radaronline.com,White House Feud Erupts as Elon Musk Gets Into WWE-Style 'Shouting Match' With Mild-Mannered Cabinet Secretary
TSLA,2025-04-24,2025-04-24T17:25:00Z,Jalopnik,Volkswagen's Electric Bus Brings A Cute Face To New Uber Autonomous Rideshare Waymo Competitor
TSLA,2025-04-24,2025-04-24T17:25:00Z,Quartz India,5 businesses Elon Musk is refocusing on as he leaves DOGE — and how they did while he was busy
TSLA,2025-04-25,2025-04-25T23:37:00Z,Snopes.com,Elon Musk didn't fund robotic legs for injured police dogs
TSLA,2025-04-25,2025-04-25T23:31:51Z,BBC News,How much has Elon Musk's Doge cut from US government spending?
TSLA,2025-04-25,2025-04-25T23:18:40Z,The Jerusalem Post,"White House wants to defund independent Social Security board, sources say"
TSLA,2025-04-25,2025-04-25T23:07:12Z,New York Post,"The left blindly hates Elon Musk, but Americans owe him thanks"
TSLA,2025-04-25,2025-04-25T22:55:12Z,WebProNews,How AI Agents Will Reshape the Enterprise
TSLA,2025-04-25,2025-04-25T22:34:09Z,TechCrunch,TechCrunch Mobility: Slate’s ‘transformer’ EV truck breaks cover and Tesla’s dueling realities | TechCrunch
TSLA,2025-04-25,2025-04-25T22:24:24Z,Yahoo Entertainment,"Jim Cramer Reacts to Tesla (TSLA) Rally: “Musk Is Back, That’s Enough”"
TSLA,2025-04-25,2025-04-25T22:21:00Z,The Star Online,U.S. stocks close higher to end the week
TSLA,2025-04-25,2025-04-25T22:10:53Z,Raw Story,'I’m the reincarnation': Book claims Musk thought himself reborn 'spirit' of ancient king
TSLA,2025-04-25,2025-04-25T22:07:39Z,CBS News,"DOGE's $160 billion in savings have cost $135 billion, analysis finds"
TSLA,2025-04-25,2025-04-25T21:51:30Z,Cointelegraph,Traders still offloading TRUMP holdings after dinner announcement — Nansen
TSLA,2025-04-25,2025-04-25T21:32:40Z,Slashdot.org,Tesla Stock Soars to End a Solid Week. Robotaxis Just Got a Step Closer. - Barron's
TSLA,2025-04-25,2025-04-25T21:27:07Z,Biztoc.com,Tesla and Alphabet Are Up After Earnings… Should You Buy?
TSLA,2025-04-25,2025-04-25T21:27:01Z,Biztoc.com,Tech giants push U.S. stocks higher with Tesla leading the pack
TSLA,2025-04-25,2025-04-25T21:27:01Z,Biztoc.com,Tech giants push U.S. stocks higher with Tesla leading the pack
TSLA,2025-04-25,2025-04-25T21:15:00Z,Newser,Top College Recruit Comes Out of Coma After Tesla Crash
TSLA,2025-04-25,2025-04-25T21:11:38Z,Yahoo Entertainment,Tesla Begins Refunding Early India Model 3 Bookings Amid Expansion Plans
TSLA,2025-04-25,2025-04-25T21:05:04Z,Biztoc.com,Surprising robotaxi news sends Tesla stock surging
TSLA,2025-04-25,2025-04-25T21:03:56Z,CoinDesk,Swiss National Bank Rejects Calls to Add Bitcoin Reserves
TSLA,2025-04-25,2025-04-25T21:00:00Z,Drive.com.au,Leapmotor B01 is a $20k cut-price Tesla Model 3 rival
TSLA,2025-04-25,2025-04-25T20:56:34Z,Yahoo Entertainment,Tesla Shares Rise as U.S. Moves to Ease Rules on Self-Driving Cars
TSLA,2025-04-25,2025-04-25T20:53:44Z,Biztoc.com,Stocks Claw Back Most of April’s Tariff Losses
TSLA,2025-04-25,2025-04-25T20:53:36Z,Biztoc.com,"Tesla Stock Is a Buy for 3 Reasons, Says Analyst. Plus, Apple v. Tariffs, and More"
TSLA,2025-04-25,2025-04-25T20:52:00Z,Vanity Fair,The Optics Battle of Luigi Mangione’s Federal Arraignment
TSLA,2025-04-25,2025-04-25T20:49:39Z,NBC News,"S&P 500 closes higher for a fourth day in a row, notches 4% gain for the week"
TSLA,2025-04-25,2025-04-25T20:49:06Z,Babylonbee.com,FBI Agents Discover 17 More Illegals Hiding In Judge Dugan’s Robe
TSLA,2025-04-25,2025-04-25T20:42:47Z,Biztoc.com,"The Score: Tesla, Capital One, Boeing and More Stocks That Defined the Week"
TSLA,2025-04-25,2025-04-25T20:11:02Z,Investopedia,Why Tesla Stock Just Had Its Best Week Since November
TSLA,2025-04-25,2025-04-25T20:09:25Z,Biztoc.com,Clean-Energy Factories Are Being Cancelled as Problems Pile Up
TSLA,2025-04-25,2025-04-25T20:09:20Z,Biztoc.com,What Bear Market? These 3 Dow Jones Stocks Are Bucking the Trend
TSLA,2025-04-25,2025-04-25T20:09:16Z,Biztoc.com,"U.S. stocks end higher with Dow, S&P 500 and Nasdaq all scoring weekly gains"
TSLA,2025-04-25,2025-04-25T20:09:15Z,Biztoc.com,Novavax Falls on Report That FDA Wants New Covid Vaccine Trial
TSLA,2025-04-25,2025-04-25T20:09:15Z,Biztoc.com,Penn Entertainment to Nominate Dissident’s Choices to Board
TSLA,2025-04-25,2025-04-25T20:00:35Z,Yahoo Entertainment,"Stock market today: Tesla surges 9%, S&P 500 gains for 4th-straight day in longest win streak since January"
TSLA,2025-04-25,2025-04-25T20:00:00Z,Cointelegraph,"Crypto Biz: Cantor Fitzgerald crypto play, ETF inflows highlight industry’s big sentiment shift"
TSLA,2025-04-25,2025-04-25T19:58:31Z,Biztoc.com,Omers’ Eric Haley Retires in Latest Change Within Private Equity
TSLA,2025-04-25,2025-04-25T19:58:29Z,Biztoc.com,"US Eyes Post-War Joint Business With Russia in Energy, Metals"
TSLA,2025-04-25,2025-04-25T19:58:12Z,Biztoc.com,"Tesla Surges 10% Friday, On Track For 2025's Best Week As Robotaxi Hype Builds"
TSLA,2025-04-25,2025-04-25T19:47:34Z,Biztoc.com,"Sources: Chinese AI startup Manus raised $75M led by Benchmark at a $500M valuation, and plans to expand to markets including the US, Japan, and the Middle East"
TSLA,2025-04-25,2025-04-25T19:47:22Z,Biztoc.com,China criticizes US for 'recent abuse' of tariffs
TSLA,2025-04-25,2025-04-25T19:47:17Z,Biztoc.com,Dollar Slightly Higher on Possible Tariff Relief
TSLA,2025-04-25,2025-04-25T19:47:15Z,Biztoc.com,"Deliveroo, which listed in London with a £7.6B valuation in 2021, says it received a buyout proposal from DoorDash that would value the company at £2.7B"
TSLA,2025-04-25,2025-04-25T19:47:14Z,Biztoc.com,The US SEC Chairman says the agency has ample authority to oversee digital assets as Congress debates if SEC or the CFTC should be the primary crypto regulator
TSLA,2025-04-25,2025-04-25T19:43:51Z,PCMag.com,BYO Tech? 'Slate' EV Startup Is Making Customizable Cars for Gearheads
TSLA,2025-04-25,2025-04-25T19:43:51Z,PCMag.com,BYO Tech? 'Slate' EV Startup Is Making Customizable Cars for Gearheads
TSLA,2025-04-25,2025-04-25T19:43:40Z,Fark.com,Tesla stock up 8% over news that Elon's DOT loosens restrictions over self-driving cars [Murica]
TSLA,2025-04-25,2025-04-25T19:36:54Z,Babylonbee.com,Man Saves Hundreds Of Thousands In Student Loans By Just Learning How To Hate Jews On The Internet
TSLA,2025-04-25,2025-04-25T19:36:41Z,Biztoc.com,What a plunge in shipping traffic from China says about tariffs and the economy
TSLA,2025-04-25,2025-04-25T19:36:39Z,Biztoc.com,"Dow Jones Today: Stocks Rise to Extend Winning Streak to Four Days as Tesla, Nvidia Lead Tech Rally; Major Indexes on Track for Big Weekly Gains"
TSLA,2025-04-25,2025-04-25T19:36:36Z,Biztoc.com,Meet the man who made six figures selling anti-Elon Musk Tesla stickers
TSLA,2025-04-25,2025-04-25T19:36:19Z,Biztoc.com,Technical Short Covering Lifts Nat-Gas Prices
TSLA,2025-04-25,2025-04-25T19:25:40Z,Biztoc.com,Private Banker Managing $5 Billion Joins BofA from Citi
TSLA,2025-04-25,2025-04-25T19:25:25Z,Biztoc.com,"Reid Hoffman Says Tariffs, Spending Cuts Could Hurt US AI Lead"
TSLA,2025-04-25,2025-04-25T19:25:23Z,Biztoc.com,"Trump's 2026 budget proposal plans billions in cuts, New York Times reports"
TSLA,2025-04-25,2025-04-25T19:25:22Z,Biztoc.com,"Is the U.S. Talking to China About Tariffs? Trump Says Yes, Beijing Says No"
TSLA,2025-04-25,2025-04-25T19:25:16Z,Biztoc.com,California proposes testing of autonomous heavy-duty vehicles on public roads
TSLA,2025-04-25,2025-04-25T19:25:12Z,Biztoc.com,Can the Tail Truly Wag the Dog? We Might Find Out Soon With a New Leveraged ETF
TSLA,2025-04-25,2025-04-25T19:23:55Z,Fox News,Former NBA star Gilbert Arenas' son out of induced coma after serious car accident: report
TSLA,2025-04-25,2025-04-25T19:23:19Z,NBC News,"Top basketball recruit, son of former NBA star Gilbert Arenas out of coma following car accident"
TSLA,2025-04-25,2025-04-25T19:19:06Z,Electrek,"Podcast: Electrek at Shanghai Auto Show, Tesla earnings, Slate cheap EV pickup unveiled, and more"
TSLA,2025-04-25,2025-04-25T19:17:22Z,PCMag.com,'Tesla Takedown' Movement Eyes Expansion to Include SpaceX's Starlink
TSLA,2025-04-25,2025-04-25T19:17:22Z,PCMag.com,'Tesla Takedown' Movement Eyes Expansion to Include SpaceX's Starlink
TSLA,2025-04-25,2025-04-25T19:14:35Z,Biztoc.com,What a plunge in shipping traffic from China says about tariffs and the economy
TSLA,2025-04-25,2025-04-25T19:14:11Z,Biztoc.com,"Dear Microsoft Stock Fans, Mark Your Calendars for April 30"
TSLA,2025-04-25,2025-04-25T19:14:05Z,Biztoc.com,Why Tesla Stock Is Soaring Today
TSLA,2025-04-25,2025-04-25T19:13:54Z,Biztoc.com,Colombia's central bank expected to hold rates despite government pressure- Reuters poll
TSLA,2025-04-25,2025-04-25T19:12:59Z,Financial Post,Tech giants push U.S. stocks higher with Tesla leading the pack
TSLA,2025-04-25,2025-04-25T19:12:44Z,Slashdot.org,American Consumers Serve Up Bleak Outlook on Economy - WSJ
TSLA,2025-04-25,2025-04-25T19:12:15Z,Marca,"Alijah Arenas emerges from coma, makes significant progress after Cybertruck accident"
TSLA,2025-04-25,2025-04-25T19:07:19Z,NBCSports.com,USC basketball recruit Arenas is out of an induced coma after vehicle crash
TSLA,2025-04-25,2025-04-25T19:07:07Z,Business Insider,Tesla stock has spiked 20% since Musk said he's stepping back from DOGE
TSLA,2025-04-25,2025-04-25T18:50:25Z,Babylonbee.com,'Christianity Today' Announces It Has Converted To Islam
TSLA,2025-04-25,2025-04-25T18:32:34Z,The Daily Caller,"SANDOVAL: Left Wing Media Seethes At Young, Fertile, Republican Women"
TSLA,2025-04-25,2025-04-25T18:29:45Z,Biztoc.com,Tesla’s Biggest Bull Just Issued a ‘Code Red’ Warning for Tesla Stock
TSLA,2025-04-25,2025-04-25T18:20:06Z,Electrek,"The Tesla (TSLA) dilemma: company is cooked with Musk, but stock crashes without him"
TSLA,2025-04-25,2025-04-25T18:05:02Z,CNBC,California is overhauling its self-driving vehicle regulations
TSLA,2025-04-25,2025-04-25T18:02:56Z,Yahoo Entertainment,USC basketball recruit Alijah Arenas is out of an induced coma after vehicle crash in Los Angeles
TSLA,2025-04-25,2025-04-25T18:01:55Z,Yahoo Entertainment,"Robotaxi Showdown: Tesla Hits the Gas, Waymo Changes Gears"
TSLA,2025-04-25,2025-04-25T18:00:00Z,Electrek,"OUKITEL P5000 5,120Wh power station at exclusive $1,299, ENGWE e-bikes up to $850 off, Jackery Explorer 100 plus, Rad Power, more"
TSLA,2025-04-25,2025-04-25T17:59:40Z,Freerepublic.com,Democrat Representative Urges Protesters To Harass Congressmen At Church
TSLA,2025-04-25,2025-04-25T17:56:48Z,Biztoc.com,U.S. loosens safety rules for self-driving cars in a bid to compete with China
TSLA,2025-04-25,2025-04-25T17:56:45Z,Biztoc.com,This Week in AI: Google Expands AI and ‘Generative Ghosts’ Are Coming
TSLA,2025-04-25,2025-04-25T17:56:24Z,The Times of India,"WATCH: Tesla FSD’s unexpected detour goes viral, even Elon Musk joins the fun"
TSLA,2025-04-25,2025-04-25T17:56:11Z,Securityaffairs.com,JPCERT warns of DslogdRAT malware deployed in Ivanti Connect Secure
TSLA,2025-04-25,2025-04-25T17:53:12Z,Slashdot.org,"Wall Street set for weekly gains with trade signals, earnings in focus - Reuters"
TSLA,2025-04-25,2025-04-25T17:53:01Z,Slashdot.org,Bezos-backed Slate Auto unveils affordable EV truck - NBC News
TSLA,2025-04-25,2025-04-25T17:48:16Z,Freerepublic.com,Sleeping Long Island teen busted for DUI after driving Tesla down Connecticut highway on autopilot: ‘Just dangerous’
TSLA,2025-04-25,2025-04-25T17:46:05Z,Biztoc.com,Treasuries Rally With Dollar on Signs of Easing Trade Tensions
TSLA,2025-04-25,2025-04-25T17:45:59Z,Biztoc.com,"Carmakers Will Only Raise Prices to Offset Tariffs as Last Resort, AutoNation Says"
TSLA,2025-04-25,2025-04-25T17:45:58Z,Biztoc.com,"Reeves Says Deal Discussed With Bessent Will Serve Both UK, US"
TSLA,2025-04-25,2025-04-25T17:45:51Z,Biztoc.com,"Analysis-Yen, BOJ's rate policy may remain focus in Japan-US trade talks"
TSLA,2025-04-25,2025-04-25T17:45:44Z,Biztoc.com,"Google Cloud, AI, ads, Waymo, and more: Google earnings takeaways"
TSLA,2025-04-25,2025-04-25T17:45:39Z,Biztoc.com,Suriname Meets With IMF to Discuss Successor Program Before Vote
TSLA,2025-04-25,2025-04-25T17:45:36Z,Biztoc.com,Nasdaq Inc Reports Massive Free Cash Flow and a 13% Dividend Hike - NDAQ Stock Looks Cheap
TSLA,2025-04-25,2025-04-25T17:42:59Z,Babylonbee.com,Federal Judge Travels Back In Time To Overturn Trump’s Birth
TSLA,2025-04-25,2025-04-25T17:36:21Z,New York Post,"Chinese electric car giant BYD’s profit doubles as it continues to cruise past rival, Elon Musk’s Tesla"
TSLA,2025-04-25,2025-04-25T17:35:24Z,Gizmodo.com,"New American EV Company Is Taking on Elon Musk With a $20,000 Truck"
TSLA,2025-04-25,2025-04-25T17:35:08Z,Biztoc.com,"Hogs Rallying on Friday, with Cutout Strength"
TSLA,2025-04-26,2025-04-26T23:38:20Z,Biztoc.com,"Chair’s Statement: Fifty-First Meeting of the IMFC - Mr. Mohammed Aljadaan, Minister for Finance of Saudi Arabia"
TSLA,2025-04-26,2025-04-26T23:26:54Z,Biztoc.com,"Prompt engineering roles, one of the buzziest jobs in 2023, become obsolete as AI models better intuit user intent and companies train staff in writing prompts"
TSLA,2025-04-26,2025-04-26T23:15:51Z,Biztoc.com,Anti-Elon Tesla sticker maker confirms some customers don’t disapprove of Musk
TSLA,2025-04-26,2025-04-26T23:15:50Z,Biztoc.com,"DeFi Development Company, the ‘MSTR of Solana,’ files $1 billion shelf offering with SEC"
TSLA,2025-04-26,2025-04-26T22:51:13Z,9News,Federal Election 2025: Labor to announce $204 million investment for 24/7 health advice and free online GP appointments
TSLA,2025-04-26,2025-04-26T22:31:37Z,Biztoc.com,Tesla could benefit the most from new rules on reporting of self-driving car crashes
