ticker,date,publishedAt,source,title
GOOGL,2025-04-25,2025-04-25T23:45:44Z,CBC News,416 to the 942? Toronto's getting a new area code but some say nothing compares to the original
GOOGL,2025-04-25,2025-04-25T23:37:07Z,Bleeding Cool News,WWE SmackDown Preview: Two Free Title Matches and a John Cena
GOOGL,2025-04-25,2025-04-25T23:37:00Z,Snopes.com,Elon Musk didn't fund robotic legs for injured police dogs
GOOGL,2025-04-25,2025-04-25T23:18:32Z,Ozbargain.com.au,"TCL 85"" C855 4K QD Mini-LED Google TV (2024) $2545 + Delivery ($0 C&C/ in Limited Store) @ JB Hi-Fi"
GOOGL,2025-04-25,2025-04-25T23:15:00Z,9to5google.com,"Google Photos made search annoying, but this handy shortcut makes it better"
GOOGL,2025-04-25,2025-04-25T23:13:26Z,Slashdot.org,Live updates: Trump in Rome to join dozens of world leaders at funeral for Pope Francis - The Washington Post
GOOGL,2025-04-25,2025-04-25T23:13:21Z,Gizchina.com,Ulefone Armor 28 Pro Launches: Brings Powerful Performance For Affordable Price
GOOGL,2025-04-25,2025-04-25T23:12:55Z,Slashdot.org,How Android 16's new security mode will stop USB-based attacks - Android Authority
GOOGL,2025-04-25,2025-04-25T23:06:07Z,Bleeding Cool News,"Fire Country: Our Preview For Tonight's 2-Hour, 2-Ep Season 3 Finale"
GOOGL,2025-04-25,2025-04-25T23:05:24Z,The Jerusalem Post,"IDF used AI to eliminate Hamas official, locate hostages"
GOOGL,2025-04-25,2025-04-25T23:00:00Z,MMA Fighting,UFC Kansas City preview show: How close are Ian Machado Garry and Carlos Prates to a title fight?
GOOGL,2025-04-25,2025-04-25T23:00:00Z,The Daily Dot,"Man buys $31,000 Chevy Silverado from the dealership. Then he tries to register the car"
GOOGL,2025-04-25,2025-04-25T22:59:46Z,Android Headlines,Google Is Burning the Internet to Save Itself — And AI Is the Match
GOOGL,2025-04-25,2025-04-25T22:56:00Z,Angryasianman.com,They Call Us The Wedding Banquet
GOOGL,2025-04-25,2025-04-25T22:46:38Z,Simonsfoundation.org,Simons Foundation Launches Collaboration on Ecological Neuroscience
GOOGL,2025-04-25,2025-04-25T22:44:58Z,KCCI Des Moines,Iowa weather: Spring hummingbird migration reaches Iowa
GOOGL,2025-04-25,2025-04-25T22:40:00Z,Slashdot.org,Google Is Killing Software Support For Early Nest Thermostats
GOOGL,2025-04-25,2025-04-25T22:37:07Z,Bleeding Cool News,Tracker Season 2 Preview Update: Melissa Roxburgh Returns & More!
GOOGL,2025-04-25,2025-04-25T22:36:24Z,Android Headlines,Android 16 has a clever way to defeat USB-based hacking
GOOGL,2025-04-25,2025-04-25T22:34:46Z,WMUR Manchester,"Texas congressman visits NH to support Trump, state Republicans"
GOOGL,2025-04-25,2025-04-25T22:33:42Z,Yahoo Entertainment,Is Alphabet Inc. (GOOGL) the Best Safe Stock to Buy According to Hedge Funds?
GOOGL,2025-04-25,2025-04-25T22:32:26Z,WMUR Manchester,NH senators seek data on gender-related breast removal surgery
GOOGL,2025-04-25,2025-04-25T22:31:18Z,XDA Developers,5 great features Windows 8 introduced that it doesn't get enough credit for
GOOGL,2025-04-25,2025-04-25T22:30:42Z,Ozbargain.com.au,"TCL 98"" C655 QLED 4K Google TV (2024) $2930 + Delivery (0% C&C and Delivery at Select Stores) @ JB Hi-Fi"
GOOGL,2025-04-25,2025-04-25T22:21:00Z,The Star Online,U.S. stocks close higher to end the week
GOOGL,2025-04-25,2025-04-25T22:16:45Z,Tubefilter,"Have you heard? MrBeast’s baseball stats, CaseOh’s cat computer, and Trisha Paytas’ pope drama"
GOOGL,2025-04-25,2025-04-25T22:13:08Z,CBS News,Small businesses push for exemptions from Trump tariffs
GOOGL,2025-04-25,2025-04-25T22:11:16Z,Biztoc.com,Google’s AI Overviews now reach more than 1.5 billion people every month
GOOGL,2025-04-25,2025-04-25T22:10:51Z,CleanTechnica,​Switzerland Unveils World’s First Operational Solar Railway Project​
GOOGL,2025-04-25,2025-04-25T22:09:10Z,CleanTechnica,"Third Of China’s Farms Sprayed By Drones, Marking Agricultural Revolution"
GOOGL,2025-04-25,2025-04-25T22:08:07Z,Bleeding Cool News,The Chronicles Of Narnia: Emma Mackey Has Been Cast As The White Witch
GOOGL,2025-04-25,2025-04-25T22:07:27Z,Mactrast.com,Apple’s AI Chief John Giannandrea to No Longer Oversee Apple’s Secret Robotics Division
GOOGL,2025-04-25,2025-04-25T22:02:52Z,Crazyegg.com,How To Reduce Bounce Rate Right Now. 17 Instant Fixes
GOOGL,2025-04-25,2025-04-25T22:00:25Z,Boredpanda.com,"Guy Makes A List Of 13 Modern Life Things That Sound Illogical, But Are Actually True"
GOOGL,2025-04-25,2025-04-25T21:59:11Z,FAIR,"FAIR: As Israel Openly Declares Starvation as a Weapon, Media Still Hesitate to Blame It for Famine"
GOOGL,2025-04-25,2025-04-25T21:58:50Z,The Verge,"Gmail gets a slider on Android tablets, AI on the side"
GOOGL,2025-04-25,2025-04-25T21:58:20Z,Android Authority,GE CYNC Outdoor Smart Plug deal: Make your outdoor electronics smart on the cheap!
GOOGL,2025-04-25,2025-04-25T21:57:35Z,Android Police,Upcoming Android setting basically puts a condom on your USB port
GOOGL,2025-04-25,2025-04-25T21:56:48Z,Pointblog.net,Igniting Success: Mastering Digital Marketing Strategies
GOOGL,2025-04-25,2025-04-25T21:53:00Z,Hot Hardware,Adobe Teams With OpenAI And Google To Turbocharge Firefly AI Image Tool
GOOGL,2025-04-25,2025-04-25T21:50:38Z,Raw Story,'Condescending': Dem slammed for 'war plan' that questions voters' intelligence
GOOGL,2025-04-25,2025-04-25T21:50:13Z,Digital Journal,Why leadership coaching is the ultimate competitive advantage
GOOGL,2025-04-25,2025-04-25T21:49:34Z,Biztoc.com,Google’s $70 Billion Buyback Will Help the Stock. Don’t Expect It to Take Off
GOOGL,2025-04-25,2025-04-25T21:48:40Z,Android Police,Google Assistant's shutdown continues with Driving Mode going away
GOOGL,2025-04-25,2025-04-25T21:48:21Z,Android Central,Google officially killed Driving Mode after stripping most of its features in 2024
GOOGL,2025-04-25,2025-04-25T21:45:39Z,Seclists.org,"ONOS, ONF, Aether, SEBA/VOLTHA - No more moves?"
GOOGL,2025-04-25,2025-04-25T21:45:08Z,Bleeding Cool News,"The Full Boom Studios July 2025 Solicits, With The War, Dune & Fence"
GOOGL,2025-04-25,2025-04-25T21:43:35Z,9to5Toys,You can gain a budget-friendly helper for floors with roborock’s Q5 Pro+ robot vac & mop + a self-empty station at its $300 low
GOOGL,2025-04-25,2025-04-25T21:41:42Z,Digital Journal,Leading AI application professions revealed
GOOGL,2025-04-25,2025-04-25T21:40:11Z,Slickdeals.net,New Visible Customers: Google Pixel 9A Smartphone (Locked) + 2-Months of Service from $249 + Free Shipping
GOOGL,2025-04-25,2025-04-25T21:39:38Z,WebProNews,Unlock the Secrets to Driving Exponential Website Traffic
GOOGL,2025-04-25,2025-04-25T21:38:35Z,Pockettactics.com,Crunchyroll Game Vault - how to get started for free with the anime games app
GOOGL,2025-04-25,2025-04-25T21:37:06Z,Bleeding Cool News,SurrealEstate Composer on Supernatural Series' Eclectic Influences
GOOGL,2025-04-25,2025-04-25T21:30:00Z,TechRadar,The AI That Cried AAAAAAHHH!
GOOGL,2025-04-25,2025-04-25T21:26:24Z,Android Headlines,Google Translate might actually teach you a new language
GOOGL,2025-04-25,2025-04-25T21:24:19Z,Android Headlines,Google Photos now lets you quickly edit before sharing an image
GOOGL,2025-04-25,2025-04-25T21:21:49Z,Forbes,"Android Circuit: Galaxy Z Flip 7 Details, Gmail’s Unsubscribe Help, Pixel 10 Design Leaks"
GOOGL,2025-04-25,2025-04-25T21:17:32Z,Soitis.dev,Show HN: AI Overview Hider for Google
GOOGL,2025-04-25,2025-04-25T21:15:27Z,Android Headlines,Pixel Watch media controls now let you shuffle and repeat tracks
GOOGL,2025-04-25,2025-04-25T21:12:51Z,New York Post,Biotech mogul Sam Waksal— of Martha Stewart ‘insider trading’ fame— accused of testing illegal pig drug on child: lawsuit
GOOGL,2025-04-25,2025-04-25T21:12:37Z,9to5Toys,Clear your cluttered desk with this Anker 112W 6-port charging station and an included cable organizer at $30
GOOGL,2025-04-25,2025-04-25T21:12:06Z,Bleeding Cool News,Helluva Boss Joins Hazbin Hotel on Prime Video; Seasons 3 & 4 Ordered
GOOGL,2025-04-25,2025-04-25T21:11:07Z,Financial Post,S&P/TSX composite inches down while U.S. markets see gains
GOOGL,2025-04-25,2025-04-25T21:05:14Z,The Times of India,PhD Student Rejects NASA Internship: Here’s why Daniela Lucas took the step
GOOGL,2025-04-25,2025-04-25T21:01:53Z,Financial Post,S&P/TSX composite inches down while U.S. markets see gains
GOOGL,2025-04-25,2025-04-25T20:53:13Z,Pypi.org,airless-google-cloud-vertexai 0.1.0
GOOGL,2025-04-25,2025-04-25T20:52:55Z,KPBS,EPA chief visits San Diego amid sewage crisis; a look at big spending by California lobbyists
GOOGL,2025-04-25,2025-04-25T20:51:51Z,Pypi.org,airless-google-cloud-bigquery 0.1.0
GOOGL,2025-04-25,2025-04-25T20:51:31Z,Boredpanda.com,“Lovebirds” Kristen Stewart And Wife Dylan Meyer Share Intimate Wedding Snaps Filled With PDA
GOOGL,2025-04-25,2025-04-25T20:49:39Z,NBC News,"S&P 500 closes higher for a fourth day in a row, notches 4% gain for the week"
GOOGL,2025-04-25,2025-04-25T20:43:16Z,WebProNews,"YouTube Follows Google Search, Tests AI Overviews"
GOOGL,2025-04-25,2025-04-25T20:41:29Z,redmondpie.com,Get Windows 11 Pro From $24 – Upgrade Easily And Smartly With VIP-CDKDeals
GOOGL,2025-04-25,2025-04-25T20:40:49Z,The Times of India,Apple Warning to iPhone Users: Delete this app over privacy risks. Here’s all we know
GOOGL,2025-04-25,2025-04-25T20:39:37Z,9to5Mac,CarPlay just added three new features with iOS 18.4
GOOGL,2025-04-25,2025-04-25T20:37:07Z,Bleeding Cool News,It's Always Sunny in Philadelphia Season 17: Mac & Frank Get Fired-Up
GOOGL,2025-04-25,2025-04-25T20:33:06Z,Slashdot.org,David Andrews Has Strong Take On Patriots Drafting Will Campbell - NESN
GOOGL,2025-04-25,2025-04-25T20:32:34Z,Slashdot.org,Google announces 1st and 2nd gen Nest Thermostats will lose support in October 2025
GOOGL,2025-04-25,2025-04-25T20:32:24Z,VentureBeat,The new AI calculus: Google’s 80% cost edge vs. OpenAI’s ecosystem
GOOGL,2025-04-25,2025-04-25T20:30:00Z,Bangkok Post,Shares rise as trade tensions ease slightly
GOOGL,2025-04-25,2025-04-25T20:30:00Z,9to5google.com,Pixelated 051: I/O 2025 pre-preview ft. Android
GOOGL,2025-04-25,2025-04-25T20:28:40Z,The Verge,Google announces a special Android event ahead of I/O
GOOGL,2025-04-25,2025-04-25T20:25:00Z,Jalopnik,Why Won't The Vatican Let Formula 1 Race Inside Its Walls?
GOOGL,2025-04-25,2025-04-25T20:24:34Z,The Verge,Why are companies lining up to buy Chrome?
GOOGL,2025-04-25,2025-04-25T20:24:12Z,The Verge,OnePlus 13R review: Maybe just buy a Pixel 9A
GOOGL,2025-04-25,2025-04-25T20:22:48Z,Android Central,Google is dropping support for the first two generations of Nest Learning Thermostat
GOOGL,2025-04-25,2025-04-25T20:20:37Z,Boredpanda.com,"Tyra Banks Looks “Unrecognizable” At Fashion Gala, Fans Think It’s The Nose Job"
GOOGL,2025-04-25,2025-04-25T20:20:00Z,GlobeNewswire,Okeanis Eco Tankers Corp. – Announcement of 2025 Annual Meeting of Shareholders
GOOGL,2025-04-25,2025-04-25T20:19:27Z,Android Central,"I want Motorola to make a Galaxy Z Fold competitor, but the Razr Ultra is still tempting"
GOOGL,2025-04-25,2025-04-25T20:12:07Z,Bleeding Cool News,DOOM: The Dark Ages Reveals New Location Via PS5
GOOGL,2025-04-25,2025-04-25T20:09:36Z,9to5Toys,"Get versatility alongside 3,200 PSI with this EGO 56V cordless electric pressure washer kit back at its $699 low (Reg. $849)"
GOOGL,2025-04-25,2025-04-25T20:09:21Z,The Verge,Perplexity’s CEO on fighting Google and the coming AI browser war
GOOGL,2025-04-25,2025-04-25T20:09:06Z,Ozbargain.com.au,"[Android, iOS] Free - Dungeon Defense @ Google Play & Apple App Store"
GOOGL,2025-04-25,2025-04-25T20:08:24Z,Pypi.org,gam7 7.6.11
GOOGL,2025-04-25,2025-04-25T20:07:04Z,Ericgoldman.org,Section 230 and the First Amendment Curtail An Online Videogame Addiction Lawsuit–Angelilli v. Activision
GOOGL,2025-04-25,2025-04-25T20:05:24Z,Yahoo Entertainment,Markets notch small gains as tech stocks rise and Trump delivers mixed signals on tariffs
GOOGL,2025-04-25,2025-04-25T20:04:52Z,PhoneArena,Back to the year 2000? Yahoo is waiting with open arms for a Google to sell Chrome
GOOGL,2025-04-25,2025-04-25T20:04:12Z,HackRead,Why Developers Should Care About Generative AI (Even They Aren’t AI Expert)
GOOGL,2025-04-26,2025-04-26T23:59:52Z,Business Insider,Quantum computing gears up for its 'ChatGPT Moment' — and a potential talent shortage
GOOGL,2025-04-26,2025-04-26T23:36:35Z,Note.com,"What will the patent office do! ""Wake up Examiner!! ""Will it continue this year?"" It is about grantin｜久保園善章"
GOOGL,2025-04-26,2025-04-26T23:25:45Z,New York Post,"Mask-wearing thief who allegedly stole Kristi Noem’s Gucci bag containing $3K in cash, passport arrested: sources"
GOOGL,2025-04-26,2025-04-26T23:21:56Z,Nitinguptadfw.com,"Top Marketing Strategies Realtors Use to Sell Homes Fast in Mansfield, TXTips from a Top Mansfield, TX Listing Agent"
GOOGL,2025-04-26,2025-04-26T23:15:50Z,Biztoc.com,"DeFi Development Company, the ‘MSTR of Solana,’ files $1 billion shelf offering with SEC"
GOOGL,2025-04-26,2025-04-26T23:12:36Z,Slashdot.org,"Only Google Can Run Chrome, Company’s Browser Chief Tells Judge - Bloomberg.com"
GOOGL,2025-04-26,2025-04-26T23:12:08Z,Bleeding Cool News,Discrete Orange Announced As Game Boy Advance Cartridge
GOOGL,2025-04-26,2025-04-26T23:00:00Z,9to5google.com,Android Auto’s latest update rolling out as v14.3 launches in beta
GOOGL,2025-04-26,2025-04-26T23:00:00Z,Snopes.com,CIA document doesn't prove aliens turned Soviet soldiers to stone — and it was never classified
GOOGL,2025-04-26,2025-04-26T22:37:11Z,Boredpanda.com,Creep Politician Learns His Fate After Sick Assault On Daughter During Her 21st Birthday Vegas Trip
GOOGL,2025-04-26,2025-04-26T22:34:54Z,Metafilter.com,I have been told something odd about assisted living facilities
GOOGL,2025-04-26,2025-04-26T22:33:05Z,New York Post,Majority of Americans trust what’s online less than ever before: poll
GOOGL,2025-04-26,2025-04-26T22:28:13Z,Pypi.org,airbyte-source-google-directory 0.2.41
GOOGL,2025-04-26,2025-04-26T22:26:07Z,Bleeding Cool News,Detective Comics 2025 Annual #1 Preview: Can Batman Even Batman?
GOOGL,2025-04-26,2025-04-26T22:25:04Z,Trendhunter.com,Video Transcription-Enhanced Services - Google Has Enhanced Its Google Drive Platform (TrendHunter.com)
GOOGL,2025-04-26,2025-04-26T22:25:00Z,9to5google.com,Gboard on Pixel now lets you ‘Browse’ Emoji Kitchen
GOOGL,2025-04-26,2025-04-26T22:20:16Z,Pypi.org,airbyte-source-google-analytics-data-api 2.7.4
GOOGL,2025-04-26,2025-04-26T22:12:24Z,Slashdot.org,Google will stop supporting early Nest thermostats on October 25 - TechCrunch
GOOGL,2025-04-26,2025-04-26T22:03:18Z,Boredpanda.com,Melania Trump’s Whisper To Donald Decoded By Lip Reader At Pope Francis’ Funeral
GOOGL,2025-04-26,2025-04-26T22:01:02Z,Buzzfeed,Can't Deal With Your Phone's Tiny Keyboard? You Need This Game-Changing $30 Tech Purchase
GOOGL,2025-04-26,2025-04-26T21:47:06Z,Bleeding Cool News,"Riff Raff Director on 'Virginia Woolfe', Coolidge, Ensemble & More"
GOOGL,2025-04-26,2025-04-26T21:37:08Z,Bleeding Cool News,"Doctor Odyssey: Check Out Our Early S01E16: ""Double-Booked"" Preview"
GOOGL,2025-04-26,2025-04-26T21:35:10Z,Android Police,Discover the history of every Porsche Design phone ever made
GOOGL,2025-04-26,2025-04-26T21:34:00Z,Slashdot.org,'Read the Manual': Misconfigured Google Analytics Led to a Data Breach Affecting 4.7M
GOOGL,2025-04-26,2025-04-26T21:24:00Z,Hackplayers.com,Chamele-o-nization
GOOGL,2025-04-26,2025-04-26T21:17:07Z,Bleeding Cool News,Thunderbolts* Director Talks Possible Avengers: Doomsday Hints
GOOGL,2025-04-26,2025-04-26T21:12:36Z,Slashdot.org,Trump’s Blue Suit at Pope Francis’ Funeral Draws Attention - The New York Times
GOOGL,2025-04-26,2025-04-26T21:12:25Z,TechCrunch,Google’s DeepMind UK team reportedly seeks to unionize | TechCrunch
GOOGL,2025-04-26,2025-04-26T21:12:06Z,Bleeding Cool News,Wartales Reveals The Beast Hunt DLC Arriving This Week
GOOGL,2025-04-26,2025-04-26T21:02:11Z,Bleeding Cool News,Yen Press Announces 12 New Manga and Light Novels at Sakura-Con 2025
GOOGL,2025-04-26,2025-04-26T20:55:21Z,Rivals.com,2026 EDGE Tariq Boney commits to Michigan
GOOGL,2025-04-26,2025-04-26T20:55:16Z,Boredpanda.com,Prince Andrew’s Ex Slammed As “Disgusting” For Social Media Post After Virginia Giuffre’s Passing
GOOGL,2025-04-26,2025-04-26T20:52:04Z,Slashdot.org,Seahawks trade Sam Howell to the Vikings - NBC Sports
GOOGL,2025-04-26,2025-04-26T20:41:43Z,Rivals.com,Philadelphia Eagles select Myles Hinton in sixth round of NFL Draft
GOOGL,2025-04-26,2025-04-26T20:40:52Z,Biztoc.com,Google Says Workers Could Save 122 Hours Annually Using AI for Administrative Tasks
GOOGL,2025-04-26,2025-04-26T20:37:10Z,Android Police,The 9 most effective sleep apps for Android right now
GOOGL,2025-04-26,2025-04-26T20:34:00Z,Slashdot.org,YouTube is Huge - and a Few Creators Are Getting Rich
GOOGL,2025-04-26,2025-04-26T20:32:29Z,Slashdot.org,Google is pulling the plug on older Nest Thermostats - Android Police
GOOGL,2025-04-26,2025-04-26T20:29:36Z,Rivals.com,Kalel Mullings taken by Tennessee Titans in sixth round of NFL Draft
GOOGL,2025-04-26,2025-04-26T20:27:29Z,Microsoft.com,Shop Copilot+ PCs: A New Era of Windows AI PCs and Laptops | Microsoft Windows
GOOGL,2025-04-26,2025-04-26T20:26:06Z,Bleeding Cool News,TVA #5 Preview: Deferment Department Drama Unfolds
GOOGL,2025-04-26,2025-04-26T20:17:07Z,Bleeding Cool News,"Sinners Star Discusses Ryan Coogler's ""Inquisitive"" Directorial Style"
GOOGL,2025-04-26,2025-04-26T20:14:45Z,ABC News (AU),A US woman is accused of killing her boyfriend — but is it a cover-up?
GOOGL,2025-04-26,2025-04-26T20:12:14Z,Slashdot.org,"US Wants Judge to Break Up Google, Force Sale of Chrome: Here's What to Know"
GOOGL,2025-04-26,2025-04-26T20:12:08Z,Bleeding Cool News,World Of Warcraft Launched Update 11.1.5 in The War Within
GOOGL,2025-04-26,2025-04-26T20:08:41Z,CleanTechnica,Solar Power Surges Around The World
GOOGL,2025-04-26,2025-04-26T20:07:36Z,Biztoc.com,US Economy Was Already Sputtering Before Trade Pain Kicked In
GOOGL,2025-04-26,2025-04-26T20:07:34Z,Biztoc.com,The ‘Never Surrender’ President Retreats
GOOGL,2025-04-26,2025-04-26T20:02:07Z,Bleeding Cool News,Diary of a Nature Nerd: Fun Middle-Grade Graphic Novel Out in August
GOOGL,2025-04-26,2025-04-26T20:00:00Z,Betalist.com,Dropflow – Turn Invoices from Email into Google Sheets Automatically
GOOGL,2025-04-26,2025-04-26T19:56:37Z,Biztoc.com,"Shop the 50 Best Deals at Wayfair's Way Day Sale, With Savings Up to 88%"
GOOGL,2025-04-26,2025-04-26T19:54:49Z,Android Police,Google Photos has a hidden trick to tame its new AI search chaos
GOOGL,2025-04-26,2025-04-26T19:52:07Z,Bleeding Cool News,Shuri Takes on the Mantle of Black Panther with New MAFEX Figure
GOOGL,2025-04-26,2025-04-26T19:48:07Z,Bleeding Cool News,The Tremors Franchise Gets An Update About Its Next Chapter
GOOGL,2025-04-26,2025-04-26T19:47:52Z,The Gadgeteer,LIFX Luna Smart Lamp review – A smart lamp for your not so smart home
GOOGL,2025-04-26,2025-04-26T19:33:00Z,TechSpot,Robots use Cornell's RHyME AI to learn new skills by watching just one video
GOOGL,2025-04-26,2025-04-26T19:22:00Z,Brettterpstra.com,Brett Terpstra is open to work
GOOGL,2025-04-26,2025-04-26T19:20:26Z,CNET,"US Wants Judge to Break Up Google, Force Sale of Chrome: Here's What to Know"
GOOGL,2025-04-26,2025-04-26T19:20:26Z,Yahoo Entertainment,"US Wants Judge to Break Up Google, Force Sale of Chrome: Here's What to Know"
GOOGL,2025-04-26,2025-04-26T19:17:07Z,Bleeding Cool News,Dave Filoni on Sigourney Weaver's Role in The Mandalorian & Grogu
GOOGL,2025-04-26,2025-04-26T19:15:05Z,PhoneArena,This large metro area will finally let you use your iPhone’s Apple Wallet to pay for public transit
GOOGL,2025-04-26,2025-04-26T19:13:17Z,Securityaffairs.com,African multinational telco giant MTN Group disclosed a data breach
GOOGL,2025-04-26,2025-04-26T19:12:48Z,Slashdot.org,Trump says Putin may not want to ‘stop the war’ in Ukraine - Politico
GOOGL,2025-04-26,2025-04-26T19:12:38Z,Slashdot.org,Google won't bring new Nest Thermostats to Europe - Engadget
GOOGL,2025-04-26,2025-04-26T19:12:11Z,Biztoc.com,Google will stop supporting early Nest thermostats on October 25
GOOGL,2025-04-26,2025-04-26T19:05:07Z,BleepingComputer,Malware analysis specialists inquire please rootkit/malware over powered!
GOOGL,2025-04-26,2025-04-26T19:05:04Z,Fox News,Most popular beer in America revealed in new study
GOOGL,2025-04-26,2025-04-26T19:01:16Z,TechCrunch,Google will stop supporting early Nest thermostats on October 25 | TechCrunch
GOOGL,2025-04-26,2025-04-26T18:58:50Z,Pypi.org,git-auto 0.1.3
GOOGL,2025-04-26,2025-04-26T18:56:31Z,Pypi.org,git-auto 0.1.2
GOOGL,2025-04-26,2025-04-26T18:52:06Z,Bleeding Cool News,Slay with NECA Latest The Evil Dead 2-Pack with Bloody Ash & Cheryl
GOOGL,2025-04-26,2025-04-26T18:48:41Z,PhoneArena,It’s official: Google’s Gemini is coming to these devices that you probably use daily
GOOGL,2025-04-26,2025-04-26T18:47:00Z,TheStreet,Alphabet unveils answer to major AI question
GOOGL,2025-04-26,2025-04-26T18:44:02Z,Neowin,Patch My PC - Home Updater 5.2.0.0 / 4.5.0.5
GOOGL,2025-04-26,2025-04-26T18:39:18Z,Biztoc.com,Google says Chrome will suffer if it’s forced to sell the world’s most popular web browser
GOOGL,2025-04-26,2025-04-26T18:32:46Z,TalkAndroid,Best Cases For Google Pixel 9a
GOOGL,2025-04-26,2025-04-26T18:30:55Z,Yahoo Entertainment,"Khosla Ventures Leads $16.2M Series A In Loti AI, Backed By WME & CAA, To Shield Celebrities From Deepfake Threats"
GOOGL,2025-04-26,2025-04-26T18:28:57Z,CNET,Stay on Top of Your Health for Under $100 With This Fitbit Inspire 3 Deal
GOOGL,2025-04-26,2025-04-26T18:28:30Z,Askubuntu.com,"I have installed Ubuntu twice on my laptop in error, how can I remove one?"
GOOGL,2025-04-26,2025-04-26T18:27:49Z,Yahoo Entertainment,Sarr’s sizzlers send Crystal Palace soaring into FA Cup final dreamland
GOOGL,2025-04-26,2025-04-26T18:27:07Z,Bleeding Cool News,Question: All Along The Watchtower #6 Preview: Renee's Last Stand
GOOGL,2025-04-26,2025-04-26T18:13:44Z,Tom's Hardware UK,Tests indicate Intel's '200S Boost' feature provides no real gain for Arrow Lake CPUs on Linux
GOOGL,2025-04-26,2025-04-26T18:13:07Z,Bleeding Cool News,Tower Of God: New World Adds Xia Xia & Zahard In New Update
GOOGL,2025-04-26,2025-04-26T18:11:54Z,redmondpie.com,These ANC Earbuds From Anker Are Now Just $45 In 3 Gorgeous Colors
GOOGL,2025-04-26,2025-04-26T18:07:55Z,Pypi.org,selenium-simplification 0.0.14
GOOGL,2025-04-26,2025-04-26T18:05:48Z,Boredpanda.com,World Leaders Accused Of ‘Disrespect’ At Pope Francis’s Funeral
GOOGL,2025-04-26,2025-04-26T18:05:04Z,Yahoo Entertainment,Why Palantir Technologies Inc. (PLTR) Soared Last Week
GOOGL,2025-04-26,2025-04-26T18:01:05Z,redmondpie.com,Amazon’s Fire HD 8 Tablet Is Just $65 With 13 Hours Of Battery
GOOGL,2025-04-26,2025-04-26T18:00:00Z,PCMag.com,BenQ GP520
GOOGL,2025-04-26,2025-04-26T18:00:00Z,PCMag.com,BenQ GP520
GOOGL,2025-04-26,2025-04-26T17:53:12Z,Construction-physics.com,Robot Dexterity Still Seems Hard
GOOGL,2025-04-26,2025-04-26T17:52:06Z,Bleeding Cool News,Stay Cool with McFarlane's New Batman Adventures Mr. Freeze
GOOGL,2025-04-26,2025-04-26T17:38:13Z,Vevioz.com,"The Power of Digital Marketing in 2025: Why Your Business Needs SEO, PPC & More"
GOOGL,2025-04-26,2025-04-26T17:37:07Z,Bleeding Cool News,"The Walking Dead: Dead City S02: Maggie Teaser, New Images Released"
GOOGL,2025-04-26,2025-04-26T17:34:00Z,Slashdot.org,"US Attorney for D.C. Accuses Wikipedia of 'Propaganda', Threatens Nonprofit Status"
GOOGL,2025-04-26,2025-04-26T17:32:23Z,Slashdot.org,"Google says Android’s Find My Device network is 4x faster, teases UWB ‘very soon’ - 9to5Google"
GOOGL,2025-04-26,2025-04-26T17:28:59Z,Github.com,Show HN: A CV build system for developers based on HTML Jinja templates
GOOGL,2025-04-26,2025-04-26T17:27:12Z,Tom's Hardware UK,Windows will now let you swear at it — introduces toggle to disable profanity filter for voice typing
GOOGL,2025-04-27,2025-04-27T23:53:36Z,Forbes,YouTube At 20: Luis Fonsi’s ‘Despacito’ Is All-Time Most-Watched Music Video
GOOGL,2025-04-27,2025-04-27T23:49:44Z,Erickimphotography.com,Bitcoin: Write the top news in Eric Kim voice
GOOGL,2025-04-27,2025-04-27T23:49:04Z,Erickimphotography.com,Top Bitcoin news right now on Twitter X
GOOGL,2025-04-27,2025-04-27T23:47:36Z,CNBC,Asia markets live: Stocks rise
GOOGL,2025-04-27,2025-04-27T23:45:10Z,Android Police,Tablet cases: What to look for when buying tablet cases
GOOGL,2025-04-27,2025-04-27T23:37:07Z,Bleeding Cool News,The Last of Us Season 2 Episode 3 Preview: Ellie Knows Her Name
GOOGL,2025-04-27,2025-04-27T23:14:39Z,PhoneArena,Updated Google Maps UI for Android won't block users from viewing maps in the background
GOOGL,2025-04-27,2025-04-27T23:13:37Z,The Conversation Africa,People trust legal advice generated by ChatGPT more than a lawyer – new study
GOOGL,2025-04-27,2025-04-27T23:13:14Z,Slashdot.org,"A simple starter home now costs $1 million in half the states in the U.S., report reveals - Fortune"
GOOGL,2025-04-27,2025-04-27T23:13:08Z,Bleeding Cool News,Action Horror Game Frog Legs Arriving In Mid-May
GOOGL,2025-04-27,2025-04-27T23:12:00Z,Bangkok Post,Korea urged to invest in next-generation industries
GOOGL,2025-04-27,2025-04-27T23:07:07Z,Bleeding Cool News,"Watson: Check Out Our S01E11: ""The Dark Day Deduction"" Preview & More"
GOOGL,2025-04-27,2025-04-27T23:00:00Z,Snopes.com,"Pam Bondi didn't say, 'It's probably a crime to accuse the president of committing a crime after he breaks the law'"
GOOGL,2025-04-27,2025-04-27T23:00:00Z,Cloudflare.com,"Targeted by 20.5 million DDoS attacks, up 358% year-over-year: Cloudflare’s 2025 Q1 DDoS Threat Report"
GOOGL,2025-04-27,2025-04-27T22:49:24Z,Boredpanda.com,"RuPaul’s Drag Race Alum Jiggly Caliente Passes Away at 44, Days After Leg Amputation"
GOOGL,2025-04-27,2025-04-27T22:47:06Z,Bleeding Cool News,Sinners Star and Director Discuss the Possibility of Another Story
