ticker,date,publishedAt,source,title
TSLA,2025-05-09,2025-05-09T22:31:20Z,Biztoc.com,Argentina Halts Private Bond Sale Amid Pressure on Peso Rate
TSLA,2025-05-09,2025-05-09T22:31:15Z,Biztoc.com,Brian Armstrong says Coinbase considered allocating 80% of its balance sheet into bitcoin but decided against the scheme as it was too risky
TSLA,2025-05-09,2025-05-09T22:31:12Z,Biztoc.com,"Delta, Korean Air to buy 25% stake in Canada's WestJet"
TSLA,2025-05-09,2025-05-09T22:31:12Z,Biztoc.com,"Sources: Snowflake challenger ClickHouse is in talks to raise hundreds of millions led by Khosla Ventures at a $6B valuation, triple its valuation from 2021"
TSLA,2025-05-09,2025-05-09T22:30:57Z,Biztoc.com,"WEX, Acelyrin, and More Stocks See Action From Activist Investors"
TSLA,2025-05-09,2025-05-09T22:20:09Z,Biztoc.com,US Official Meets With Mexico Bankers on Cartel Financing Risks
TSLA,2025-05-09,2025-05-09T22:20:07Z,Biztoc.com,Corn Squares Up Heading into the Weekend
TSLA,2025-05-09,2025-05-09T22:20:00Z,Biztoc.com,Hogs Close the Week with Mixed Trade
TSLA,2025-05-09,2025-05-09T22:19:47Z,Biztoc.com,Cotton Post Slight Weakness on Friday
TSLA,2025-05-09,2025-05-09T22:19:47Z,Biztoc.com,Taiwan’s Export Surge Points to U.S. Stockpiling
TSLA,2025-05-09,2025-05-09T22:08:45Z,Biztoc.com,Tesla tells Model Y and Cybertruck workers to stay home for a week
TSLA,2025-05-09,2025-05-09T22:08:39Z,Biztoc.com,"Fed's Bowman picks staff from Goldman, Davis Polk and BPI, Bloomberg News reports"
TSLA,2025-05-09,2025-05-09T22:08:31Z,Biztoc.com,US Treasury secretary urges Congress to raise debt limit by mid-July
TSLA,2025-05-09,2025-05-09T22:00:00Z,New Atlas,"Isuzu D-Max pickup gets electrified, and it makes perfect sense"
TSLA,2025-05-09,2025-05-09T21:56:53Z,Next Big Future,Tesla Will Start Scaling to Millions of Robotaxi in the Next 12 Months Starting in 22 Days
TSLA,2025-05-09,2025-05-09T21:46:29Z,Biztoc.com,Trump says US will maintain 10% tariffs even after trade deals
TSLA,2025-05-09,2025-05-09T21:46:26Z,Biztoc.com,Trump Says NYC’s Adams Came to White House to ‘Thank Me’
TSLA,2025-05-09,2025-05-09T21:46:21Z,Biztoc.com,GPB Founder Gentile Gets Seven Years for Ponzi-Like Fraud
TSLA,2025-05-09,2025-05-09T21:46:18Z,Biztoc.com,This Key Stock Market Indicator Is Flashing Red
TSLA,2025-05-09,2025-05-09T21:38:01Z,CryptoSlate,Cathie Wood predicts AI and Bitcoin to drive new phase of US economic growth
TSLA,2025-05-09,2025-05-09T21:35:27Z,Biztoc.com,Trump Says 10% Tariff Baseline Unless ‘Exceptional’ Offer Made
TSLA,2025-05-09,2025-05-09T21:34:52Z,Biztoc.com,Andreessen Horowitz-Backed Omada Health Files for US IPO
TSLA,2025-05-09,2025-05-09T21:27:15Z,New York Post,"Electric air taxi firm Joby Aviation eyes White House landing,  but has deep ties to anti-Trump billionaire Reid Hoffman"
TSLA,2025-05-09,2025-05-09T21:24:02Z,Biztoc.com,"US Treasury Secretary Bessent lambasts Senate for blocking stablecoin bill, calls it ‘missed opportunity’ for American leadership"
TSLA,2025-05-09,2025-05-09T21:23:53Z,Biztoc.com,Fed's Hammack calls for clear data before rate decision - Reuters
TSLA,2025-05-09,2025-05-09T21:23:40Z,Biztoc.com,"Exclusive-Fed’s Hammack wants clear data before moving on rates, not much data by June"
TSLA,2025-05-09,2025-05-09T21:13:07Z,Biztoc.com,Trump Heading to Middle East Seeking Investments in US
TSLA,2025-05-09,2025-05-09T21:12:54Z,Biztoc.com,"Kohl’s Board Member Resigns, Adding to Retailer’s Turmoil"
TSLA,2025-05-09,2025-05-09T21:12:52Z,Biztoc.com,Draft Executive Orders Aim to Speed Construction of Nuclear Plants
TSLA,2025-05-09,2025-05-09T21:12:38Z,Biztoc.com,Seattle Businesses Take Canadian Cash at Par to Lure Sports Fans
TSLA,2025-05-09,2025-05-09T21:06:19Z,Japan Today,"Panasonic targets 10,000 job cuts worldwide"
TSLA,2025-05-09,2025-05-09T21:01:51Z,Biztoc.com,Pharma Worries Shift to Prices From Trade. Trump’s Next Plan Could Sink Stocks
TSLA,2025-05-09,2025-05-09T21:01:49Z,Biztoc.com,"This ‘Trump trade’ helped bring markets to the brink in April, Fed official says"
TSLA,2025-05-09,2025-05-09T21:01:45Z,Biztoc.com,Mexico Finance Chief Says USMCA-Protected Exports Bolster Growth
TSLA,2025-05-09,2025-05-09T21:01:41Z,Biztoc.com,The Stock Market Is Getting a Warning from Bonds and the Dollar. Tariff Turmoil Isn’t Over
TSLA,2025-05-09,2025-05-09T21:01:39Z,Biztoc.com,Peru’s Emergency Mining Ban to Cost $200 Million in Lost Gold Output
TSLA,2025-05-09,2025-05-09T21:01:36Z,Biztoc.com,Trading Day: All eyes on 'Geneva Convention'
TSLA,2025-05-09,2025-05-09T20:50:44Z,Biztoc.com,Bessent Says Debt Limit Measures Could Run Out in August
TSLA,2025-05-09,2025-05-09T20:50:37Z,Biztoc.com,Record Beef Prices to Hit Consumers This Summer
TSLA,2025-05-09,2025-05-09T20:50:35Z,Biztoc.com,Stocks Close Slightly Lower Ahead of US-China Trade Talks
TSLA,2025-05-09,2025-05-09T20:50:35Z,Biztoc.com,Trump Team Weighs Expediting Nuclear Power Plant Construction
TSLA,2025-05-09,2025-05-09T20:50:33Z,Biztoc.com,Texas is on the verge of handing Tesla and other big businesses a major win
TSLA,2025-05-09,2025-05-09T20:50:33Z,Biztoc.com,JPMorgan Caught Out by EM Currency Gains: It ‘Has Not Worked’
TSLA,2025-05-09,2025-05-09T20:50:32Z,Biztoc.com,"Trump Opens Door to Tariffs on Commercial Aircraft, Engines"
TSLA,2025-05-09,2025-05-09T20:50:28Z,Biztoc.com,Ghana’s Credit Rating Raised by S&P After Spending Cut Plans
TSLA,2025-05-09,2025-05-09T20:48:20Z,TVLine,Is FBI Officially Teasing Maggie/OA? Was Rehearsal the Weirdest? Criminal Minds Still Too Dark? Did Grosse Pointe Reveal Underwhelm? More TV Qs!
TSLA,2025-05-09,2025-05-09T20:39:36Z,Biztoc.com,Trump Weighs Suspending Migrants’ Ability to Challenge Detention
TSLA,2025-05-09,2025-05-09T20:39:23Z,Biztoc.com,"Goldman to Wind Down ETF Accelerator, Shift Servicing to Tidal"
TSLA,2025-05-09,2025-05-09T20:39:17Z,Biztoc.com,Big Wall Street Comeback Is Upending a Slew of Bear Market Bets
TSLA,2025-05-09,2025-05-09T20:39:09Z,Biztoc.com,"Coinbase Considered, Decided Against Michael Saylor’s Bitcoin Buying Strategy"
TSLA,2025-05-09,2025-05-09T20:29:18Z,Futurism,Community Complains of Choking Fumes From Elon Musk's AI Fortress
TSLA,2025-05-09,2025-05-09T20:28:42Z,Biztoc.com,"Google agrees to pay $50M to settle a lawsuit accusing it of systemic racial bias against Black employees, covering 4,000+ employees in California and New York"
TSLA,2025-05-09,2025-05-09T20:28:36Z,Biztoc.com,Tech companies warn they may pull back from US investment pledges if Congress doesn't fully reinstate the R&D tax deduction pared back in Trump's 2017 tax bill
TSLA,2025-05-09,2025-05-09T20:28:34Z,Biztoc.com,Stocks Are Up and Tariffs Haven’t Inflicted Much Pain. Why That Won’t Last
TSLA,2025-05-09,2025-05-09T20:28:31Z,Biztoc.com,Hedge Funds Soured on Oil as OPEC Agreed to Bumper Supply Hike
TSLA,2025-05-09,2025-05-09T20:28:30Z,Biztoc.com,Bank of England cuts rates in split decision before US tariff deal
TSLA,2025-05-09,2025-05-09T20:28:25Z,Biztoc.com,Fastest Payout Online Casino 2025: Lucky Creek Hailed Best Instant Withdrawal Casino
TSLA,2025-05-09,2025-05-09T20:28:17Z,Biztoc.com,Trump to allow commercial fishing in New England marine monument
TSLA,2025-05-09,2025-05-09T20:28:07Z,Biztoc.com,How an obscure bet on bonds almost crashed the $29 trillion Treasury market
TSLA,2025-05-09,2025-05-09T20:27:58Z,Biztoc.com,Sphere Entertainment Has a Dazzling Arena. The Stock Is Undervalued
TSLA,2025-05-09,2025-05-09T20:27:40Z,CNN,Bill Gates warns Elon Musk’s DOGE cuts will cause ‘millions of deaths’ | CNN Business
TSLA,2025-05-09,2025-05-09T20:24:09Z,Ai-cio.com,Pennsylvania Pension Fund Seeks Divestment of Tesla Shares
TSLA,2025-05-09,2025-05-09T20:17:17Z,Biztoc.com,"U.S. Indexes Ended Friday Mixed As Insulet Led, Affirm Holdings Lagged"
TSLA,2025-05-09,2025-05-09T20:17:08Z,Biztoc.com,Why the Senate crypto bill tanked
TSLA,2025-05-09,2025-05-09T20:17:06Z,Biztoc.com,Tesla Defeats Tank? Anti-Musk Group's Experiment May Have Backfired Into A Sales Pitch
TSLA,2025-05-09,2025-05-09T20:16:59Z,Biztoc.com,Portillo’s honors new pope with ‘The Leo’ Italian Beef sandwich
TSLA,2025-05-09,2025-05-09T20:06:11Z,Biztoc.com,This Top Morgan Stanley Team Helps Other Advisors Retire on a High Note
TSLA,2025-05-09,2025-05-09T20:06:10Z,Biztoc.com,Here Are America’s Top 250 Private Wealth Teams. The Biggest Are Getting Bigger
TSLA,2025-05-09,2025-05-09T20:06:06Z,Biztoc.com,Wealth Management Teams Are Getting Bigger. The Best Ones Are Also Getting Better
TSLA,2025-05-09,2025-05-09T20:06:03Z,Biztoc.com,Stocks end mostly lower ahead of weekend trade talks between U.S. and China
TSLA,2025-05-09,2025-05-09T20:06:01Z,Biztoc.com,Tesla tells Model Y and Cybertruck workers to stay home for a week
TSLA,2025-05-09,2025-05-09T20:06:00Z,Biztoc.com,Tech Entrepreneurs Have to Make Big Decisions About Their Money. This Team Guides Them Through Volatility
TSLA,2025-05-09,2025-05-09T20:05:59Z,Biztoc.com,FAA Weighs Broad Pullback in Newark Flights Over Radar Outages
TSLA,2025-05-09,2025-05-09T20:05:53Z,Biztoc.com,"Warsh, a potential Trump fed pick, challenges need for job loss to curb inflation"
TSLA,2025-05-09,2025-05-09T20:05:43Z,Biztoc.com,FDA and NIH launch joint research initiative for nutrition policy
TSLA,2025-05-09,2025-05-09T20:05:42Z,Biztoc.com,"Fed Governor Michelle Bowman Hires Staffers From Goldman, Davis Polk and BPI"
TSLA,2025-05-09,2025-05-09T20:05:36Z,Biztoc.com,These Advisors Offer the Best of Both Worlds: Independence With Big Bank Resources
TSLA,2025-05-09,2025-05-09T20:05:35Z,Yahoo Entertainment,"Tesla stock jumps to highest levels since February, notching 3rd straight week of gains"
TSLA,2025-05-09,2025-05-09T20:04:22Z,Business Insider,Tesla tells Model Y and Cybertruck workers to stay home for a week
TSLA,2025-05-09,2025-05-09T20:03:44Z,Electrek,"Kia EV4 test drive reveals the good, the bad, and the ugly"
TSLA,2025-05-09,2025-05-09T20:00:23Z,Yahoo Entertainment,Tesla tells Model Y and Cybertruck workers to stay home for a week
TSLA,2025-05-09,2025-05-09T19:58:43Z,Electrek,"Podcast: Tesla Model Y RWD, Cybertruck bait-and-switch, Rivian earnings, and more"
TSLA,2025-05-09,2025-05-09T19:54:55Z,Biztoc.com,Ghana’s Debt Burden Seen Falling Sharply on Economic Expansion
TSLA,2025-05-09,2025-05-09T19:54:53Z,Biztoc.com,"Tesla Stock Jumps Friday, on Track For Third Straight Week of Gains"
TSLA,2025-05-09,2025-05-09T19:54:52Z,Biztoc.com,Lutnick Expects ‘De-Escalation’ With China Before Trade Deal
TSLA,2025-05-10,2025-05-10T23:55:11Z,Biztoc.com,Google Stock Had a Bad Week. Why We’re Sticking With Our Alphabet Pick
TSLA,2025-05-10,2025-05-10T23:44:23Z,Biztoc.com,Trump Says ‘Much Agreed to’ in Meeting With Chinese Officials
TSLA,2025-05-10,2025-05-10T23:25:31Z,USA Today,Who are Afrikaners? Trump welcomes white South Africans as other refugees are halted.
TSLA,2025-05-10,2025-05-10T23:21:54Z,Biztoc.com,UK Proposes Tightening Visa Rules to Reduce Legal Migration
TSLA,2025-05-10,2025-05-10T23:21:53Z,Biztoc.com,10% Yields Every Retiree Should Own
TSLA,2025-05-10,2025-05-10T23:12:30Z,Benzinga,Tesla Fired Employee Who Created Website Criticizing Billionaire Elon Musk: Report
TSLA,2025-05-10,2025-05-10T23:11:02Z,Biztoc.com,DEI is emerging triumphant in shareholder battles across corporate America from Coca-Cola to Berkshire Hathaway
TSLA,2025-05-10,2025-05-10T23:10:41Z,Biztoc.com,It’s too late to stock up ahead of China tariffs — but here’s why you didn’t need to anyway
TSLA,2025-05-10,2025-05-10T22:59:46Z,Biztoc.com,"Klarna, which said in 2024 that AI was doing the work of 700 customer service agents, starts hiring remote workers after the AI approach led to “lower quality”"
TSLA,2025-05-10,2025-05-10T22:59:37Z,Biztoc.com,GOP Tax Bill Seeks to Put Cash in Taxpayers’ Pockets in Early 2026
TSLA,2025-05-10,2025-05-10T22:48:10Z,Biztoc.com,"If Tesla Is Only Selling This Many Trucks, How Much Growth Is There for Rivian?"
TSLA,2025-05-10,2025-05-10T22:36:57Z,Biztoc.com,Billionaire fund manager has sharp one-word reaction to tariff's impact on manufacturing
TSLA,2025-05-10,2025-05-10T22:03:44Z,Biztoc.com,Bill Gates is giving away 99% of his money. Your heirs should take notice
TSLA,2025-05-10,2025-05-10T21:55:00Z,Jalopnik,The Steps You Need To Follow To Not Brick Your Tesla When Washing It
TSLA,2025-05-10,2025-05-10T21:55:00Z,Yahoo Entertainment,The Steps You Need To Follow To Not Brick Your Tesla When Washing It
TSLA,2025-05-10,2025-05-10T21:41:25Z,Biztoc.com,"Apple Wants Its $20 Billion, and Is Willing to Throw Google Under the Bus to Keep It"
TSLA,2025-05-10,2025-05-10T21:30:16Z,Biztoc.com,Tesla Fired Employee Who Created Website Criticizing Billionaire Elon Musk: Report
TSLA,2025-05-10,2025-05-10T21:30:00Z,Boston Herald,Trillions in sales for S&P 500 companies at stake as US-China talks begin
TSLA,2025-05-10,2025-05-10T21:27:08Z,ZyCrypto,"DOGE Price Up 7% in 24h, But Experts Predict Ruvi AI (RUVI) Will Hit $2 and Grow by 20,000% in 2025"
TSLA,2025-05-10,2025-05-10T21:16:59Z,Forbes,Big Layoffs Are Hitting These Sectors The Hardest
TSLA,2025-05-10,2025-05-10T21:12:30Z,Yahoo Entertainment,Tesla Fired Employee Who Created Website Criticizing Billionaire Elon Musk: Report
TSLA,2025-05-10,2025-05-10T21:09:47Z,Tistory.com,"트럼프 무역 정책, 지속적 인플레이션 압력과 높은 실업률 초래할 것"
TSLA,2025-05-10,2025-05-10T20:56:57Z,Biztoc.com,"The UK stopped asking Uber to pay VAT on the full cost of rides, instead collecting VAT only on its commission, after a setback in a similar dispute with Bolt"
TSLA,2025-05-10,2025-05-10T20:56:51Z,Honolulu Star-Advertiser,Suspect charged in Kakaako road rage; arrested for violating Calif. parole | Honolulu Star-Advertiser
TSLA,2025-05-10,2025-05-10T20:45:41Z,Biztoc.com,Billions are lost to Medicare and Medicaid fraud. Can it pay for Trump tax cuts?
TSLA,2025-05-10,2025-05-10T20:30:00Z,GlobeNewswire,Former Billion Dollar Hedge Fund Manager Says Musk’s AI Supercomputer Could Reshape America’s Autonomous Future by June
TSLA,2025-05-10,2025-05-10T20:12:29Z,Biztoc.com,US Inflation Starting to Stir as Trump Tariff Threat Looms
TSLA,2025-05-10,2025-05-10T20:12:29Z,Biztoc.com,Once-Powerful NSC Is Sidelined by Trump as Rubio Takes the Helm
TSLA,2025-05-10,2025-05-10T19:50:11Z,Biztoc.com,"Newark's airport chaos frustrates carriers, worries travelers"
TSLA,2025-05-10,2025-05-10T19:27:35Z,Biztoc.com,Elon Musk Thinks Tesla Will Be Worth More Than Nvidia. Is It Time to Finally Buy the Stock?
TSLA,2025-05-10,2025-05-10T19:18:04Z,The Times of India,Why Is Elon Musk's 'Y' car so cheap? Tesla's 2025 model sparks EV price shock
TSLA,2025-05-10,2025-05-10T19:13:00Z,TheStreet,Elon Musk's robotaxi ambitions hit with major roadblock
TSLA,2025-05-10,2025-05-10T18:59:01Z,Yahoo Entertainment,"Tesla Bull Gary Black Reaffirms Elon Musk's Company 'Best Positioned To Capitalize' On EVs And Autonomous Driving, But There's A Catch"
TSLA,2025-05-10,2025-05-10T18:50:00Z,Yahoo Entertainment,Elon Musk Thinks Tesla Will Be Worth More Than Nvidia. Is It Time to Finally Buy the Stock?
TSLA,2025-05-10,2025-05-10T18:42:33Z,Biztoc.com,Tesla Scraps Cybertruck Range Extender
TSLA,2025-05-10,2025-05-10T18:14:29Z,InsideEVs ,Even Tesla's Insurance Arm Is Getting Wrecked
TSLA,2025-05-10,2025-05-10T17:40:38Z,Securityaffairs.com,"Ascension reveals personal data of 437,329 patients exposed in cyberattack"
TSLA,2025-05-10,2025-05-10T17:08:24Z,TechCrunch,Week in Review: Instacart CEO heads to OpenAI | TechCrunch
TSLA,2025-05-10,2025-05-10T16:28:02Z,Biztoc.com,Elon Musk's robotaxi ambitions hit with major roadblock
TSLA,2025-05-10,2025-05-10T16:00:00Z,GlobeNewswire,“Musk Just Cut the Cord”: Enrique Abeyta Says Tesla’s Dojo Supercomputer Is a Breakaway From Big Tech Dependence
TSLA,2025-05-10,2025-05-10T16:00:00Z,Yahoo Entertainment,Almost Half of Tesla Owners Say Their Cars Have Been Damaged Intentionally
TSLA,2025-05-10,2025-05-10T15:33:44Z,WBAL TV Baltimore,Police: Woman struck head-on by stolen vehicle dies
TSLA,2025-05-10,2025-05-10T15:21:42Z,Biztoc.com,the Worst Blue Chip Stock to Buy?
TSLA,2025-05-10,2025-05-10T15:02:19Z,Yahoo Entertainment,"Is Tesla, Inc. (TSLA) the Worst Blue Chip Stock to Buy?"
TSLA,2025-05-10,2025-05-10T15:00:00Z,GlobeNewswire,"Energy Storage System Market Size to worth USD 86.76 Bn by 2032, Driven by Renewable Energy Boom"
TSLA,2025-05-10,2025-05-10T14:51:38Z,Forbes,"Tesla Stock To $1,500?"
TSLA,2025-05-10,2025-05-10T14:35:38Z,Fark.com,News: Tesla shareholders get excited about new prototype. Fark: That belongs to a competitor [Fail]
TSLA,2025-05-10,2025-05-10T14:23:14Z,Securityaffairs.com,Operation Moonlander dismantled the botnet behind Anyproxy and 5socks cybercriminals services
TSLA,2025-05-10,2025-05-10T13:04:13Z,Zatznotfunny.com,The Tesla Mobile Service Experience
TSLA,2025-05-10,2025-05-10T13:01:41Z,The Times of India,"In unprecedented move, pension fund votes to halt Tesla investments citing Elon Musk’s behavior as brand-destroying liability"
TSLA,2025-05-10,2025-05-10T12:57:16Z,Biztoc.com,"Dow Jones Futures: U.S.-China Trade Talks Underway; Tesla, Palantir, Alibaba Near Buy Points"
TSLA,2025-05-10,2025-05-10T12:50:01Z,Business Insider,The richest person in every state
TSLA,2025-05-10,2025-05-10T12:43:30Z,The-independent.com,China has a big red button that hurts Elon Musk. But will they press it?
TSLA,2025-05-10,2025-05-10T12:41:13Z,New York Post,Trump to drum up major investments for US on Middle East trip: ‘Almost entirely about business deals’
TSLA,2025-05-10,2025-05-10T12:01:00Z,New York Post,"New hypercar the Divergent Czinger, is first to be 3-D printed and can go 0-60 in under two seconds"
TSLA,2025-05-10,2025-05-10T11:29:51Z,Electrek,American energy sector set to invest $100B in battery storage by 2030
TSLA,2025-05-10,2025-05-10T11:02:27Z,Yahoo Entertainment,4 Ways Tesla’s Price Cuts Could Reshape the EV Market
TSLA,2025-05-10,2025-05-10T11:00:00Z,TechRadar,"Physical buttons are finally making a comeback in cars, thanks to new safety guidelines – but I'm bracing myself for more irritating user experiences"
TSLA,2025-05-10,2025-05-10T10:35:09Z,NDTV News,"Sam Altman Extends Olive Branch To Elon Musk: ""Let's Be Friends"""
TSLA,2025-05-10,2025-05-10T10:00:00Z,Activistpost.com,From One Fake Left-wing Hysteria to the Next
TSLA,2025-05-10,2025-05-10T09:26:48Z,CBC News,Trump's drastic cuts to federal agencies temporarily halted by U.S. judge
TSLA,2025-05-10,2025-05-10T09:26:17Z,Biztoc.com,US to Probe Reports of Swabs on Its Citizens Arriving in China
TSLA,2025-05-10,2025-05-10T09:26:14Z,Biztoc.com,"Charting the Global Economy: Bank of England Eases, Fed Holds"
TSLA,2025-05-10,2025-05-10T09:15:13Z,Biztoc.com,Elon Musk’s Use of X Mimics Hearst’s and Ford’s Manipulation of Media
TSLA,2025-05-10,2025-05-10T09:15:06Z,Biztoc.com,Australia election: What are the implications for monetary policy?
TSLA,2025-05-10,2025-05-10T09:14:54Z,Biztoc.com,Are Germany's fiscal plans in conflict with EU rules? UBS weighs in
TSLA,2025-05-10,2025-05-10T09:04:53Z,eNCA,"Japan's Panasonic targets 10,000 job cuts worldwide"
TSLA,2025-05-10,2025-05-10T09:00:23Z,Futurism,Wild Video Shows Entire Mountain Range in China Covered With Solar Panels
TSLA,2025-05-10,2025-05-10T08:53:18Z,Biztoc.com,Expert discusses how tariffs on Chinese batteries are reshaping U.S. market
TSLA,2025-05-10,2025-05-10T08:53:09Z,Biztoc.com,Should markets fear a surge in U.S. student loan default rates?
TSLA,2025-05-10,2025-05-10T08:52:52Z,Biztoc.com,Citi outlines 3 funding models to unlock future U.S. infrastructure investment
TSLA,2025-05-10,2025-05-10T08:46:00Z,Yahoo Entertainment,It's About to Be Put-Up-or-Shut-Up Time for Cathie Wood's Bullish View of Tesla
TSLA,2025-05-10,2025-05-10T08:39:45Z,New York Post,Judge orders temporary halt to Trump administration’s government overhaul
TSLA,2025-05-10,2025-05-10T08:20:03Z,Biztoc.com,Trump's Tariffs Are Unbelievable. Literally
TSLA,2025-05-10,2025-05-10T08:19:59Z,Biztoc.com,The Most Profitable Dividend Strategy Is The Simplest
TSLA,2025-05-10,2025-05-10T08:19:52Z,Biztoc.com,Warren Buffett vs American Capitalism
TSLA,2025-05-10,2025-05-10T08:19:46Z,Biztoc.com,Is The Risk To The US Economy From Tariffs Overstated?
TSLA,2025-05-10,2025-05-10T08:19:35Z,Biztoc.com,Bill Gates' $200 Billion Gamble
TSLA,2025-05-10,2025-05-10T08:08:49Z,Biztoc.com,Why the World Keeps Getting Shocked by China’s Technological Progress
TSLA,2025-05-10,2025-05-10T08:08:43Z,Biztoc.com,"China Talks Are Better Than Nothing, But Don’t Expect Much of a Thaw"
TSLA,2025-05-10,2025-05-10T08:08:35Z,Biztoc.com,THC drinks are flying off shelves. Can it last?
TSLA,2025-05-10,2025-05-10T07:57:18Z,Biztoc.com,"Boohoo in Talks on £175 Million Debt Package, Telegraph Says"
TSLA,2025-05-10,2025-05-10T07:50:16Z,The Times of India,Wall Street brings the Bitcoin versus Gold clash to ETF masses
TSLA,2025-05-10,2025-05-10T07:48:14Z,7NEWS.com.au,Judge temporarily blocks Trump and Musk’s administration overhaul
TSLA,2025-05-10,2025-05-10T07:20:00Z,Gossiplankanews.com,Bill Gates Accuses Elon Musk of 'Killing Poor Children'
TSLA,2025-05-10,2025-05-10T06:36:59Z,ETF Daily News,Promising Automotive Stocks To Add to Your Watchlist – May 8th
TSLA,2025-05-10,2025-05-10T06:03:12Z,ETF Daily News,Top Industrial Stocks To Follow Today – May 8th
TSLA,2025-05-10,2025-05-10T06:03:11Z,ETF Daily News,Top Energy Stocks To Keep An Eye On – May 8th
TSLA,2025-05-10,2025-05-10T06:03:04Z,ETF Daily News,Top Utility Stocks To Consider – May 8th
TSLA,2025-05-10,2025-05-10T06:00:13Z,Bitcoinist,Bitcoin On The Menu: American Fastfood Chain Goes Crypto Nationwide
TSLA,2025-05-10,2025-05-10T05:22:35Z,Biztoc.com,Tesla Workers Told To Stay Home As Elon Musk's EV Giant Extends Memorial Day Break Following 13% Delivery Drop And Surging Inventory: Report
TSLA,2025-05-10,2025-05-10T02:55:00Z,Fark.com,"Thanks to low demand for both the Cybertruck and Model Y, the Tesla factory in Austin, TX tells workers to take the week of Memorial Day off. Oh, and no more overtime. Tag is for Elon [Dumbass]"
TSLA,2025-05-10,2025-05-10T02:46:54Z,Biztoc.com,"Tesla Poised To Gain As Texas Declares 'Dexit,' Passing Bills To Shield Companies From Shareholder Lawsuits After Elon Musk's Pay Battle"
TSLA,2025-05-10,2025-05-10T01:40:02Z,Biztoc.com,Pakistan Starts Military Action After India Missile Strikes
TSLA,2025-05-10,2025-05-10T01:06:51Z,Biztoc.com,Singapore Wealth Manager on Why It’s Not Time to Quit the US
TSLA,2025-05-10,2025-05-10T01:00:00Z,Yahoo Entertainment,Tesla hit with stunning sales news that could point to larger trend: 'We are at a worrying level'
TSLA,2025-05-10,2025-05-10T00:55:31Z,Biztoc.com,Nvidia to downgrade H20 AI chip for China to meet U.S. export controls - Reuters
TSLA,2025-05-10,2025-05-10T00:44:42Z,Biztoc.com,Trump Suggests a 100% Tariff on Hot Wheels Manufacturer Mattel
TSLA,2025-05-10,2025-05-10T00:44:34Z,Biztoc.com,"Pinterest agrees to pay $34.7M to settle a 2021 lawsuit from Christine Martinez, an early adviser who claimed she co-created the platform without compensation"
TSLA,2025-05-11,2025-05-11T23:50:00Z,DW (English),White South Africans leave for US under Trump refugee plan
TSLA,2025-05-11,2025-05-11T23:37:00Z,GlobeNewswire,CODI INVESTOR ALERT: A Class Action was filed against Compass Diversified Holdings for Securities Fraud – Contact BFA Law before June 10 Deadline (NYSE: CODI)
TSLA,2025-05-11,2025-05-11T23:34:49Z,Slashdot.org,Dow futures jump 400 points as traders await details on U.S.-China trade deal: Live updates - CNBC
TSLA,2025-05-11,2025-05-11T22:30:00Z,GlobeNewswire,The World Without Buttons: Enrique Abeyta Says Musk’s Dojo Marks the First Step Toward a Fully Autonomous Interface-Free Future
TSLA,2025-05-11,2025-05-11T20:35:43Z,Rolling Stone,Elon Musk’s Regulatory Woes Are Conveniently Vanishing Under Trump
TSLA,2025-05-11,2025-05-11T20:35:03Z,Biztoc.com,"Welcome back to Tesla, Elon Musk. We’ve missed you"
TSLA,2025-05-11,2025-05-11T20:33:21Z,Wnd.com,Zapped: Electric vehicle sales nosedive as Republicans take buzzsaw to Biden mandate
TSLA,2025-05-11,2025-05-11T20:25:20Z,Yahoo Entertainment,"Tesla, Inc. (TSLA): Among the High Growth EV Stocks to Invest In"
TSLA,2025-05-11,2025-05-11T20:23:37Z,Biztoc.com,"Tesla employees ask Elon Musk to resign, confirm massive demand problem, get fired for it"
TSLA,2025-05-11,2025-05-11T19:55:11Z,ZyCrypto,"DOGE Grows By 30%, But Experts Suggest Ruvi AI (RUVI) To be The Hidden Crypto to Grow by 20,000% in 2025"
TSLA,2025-05-11,2025-05-11T19:16:47Z,Biztoc.com,Wall Street's Ives Sees China Tariffs Heading Lower After Talks
TSLA,2025-05-11,2025-05-11T19:05:00Z,Memeorandum.com,Elon Musk's regulatory troubles have begun to melt away in Trump's second term (David Ingram/NBC News)
TSLA,2025-05-11,2025-05-11T19:00:05Z,Electrek,"Tesla employees ask Elon Musk to resign, confirm massive demand problem, get fired for it"
TSLA,2025-05-11,2025-05-11T18:54:38Z,Politicalwire.com,Elon Musk’s Regulatory Troubles Melt Away
TSLA,2025-05-11,2025-05-11T18:28:01Z,Securityaffairs.com,SECURITY AFFAIRS MALWARE NEWSLETTER ROUND 45
TSLA,2025-05-11,2025-05-11T18:16:05Z,Forbes,"2025 Cadillac Optiq EV First-Take Review: Wins On Price, Range, And AI"
TSLA,2025-05-11,2025-05-11T18:02:14Z,Securityaffairs.com,Security Affairs newsletter Round 523 by Pierluigi Paganini – INTERNATIONAL EDITION
TSLA,2025-05-11,2025-05-11T17:58:04Z,Biztoc.com,OpenAI's Sam Altman Reaches Out to Elon Musk Amid Ongoing Social Media Spat: 'Let's Be Friends'
TSLA,2025-05-11,2025-05-11T17:54:57Z,Wnd.com,"In ‘weird’ Austin, a double shot of academic counter-revolution"
TSLA,2025-05-11,2025-05-11T17:51:04Z,InsideEVs ,"Car Companies Are in a Billion-Dollar Software War, and Everyone's Losing"
TSLA,2025-05-11,2025-05-11T16:58:24Z,The Times of India,Is Donald Trump's government planning to raise retirement age? Here's the truth
