ticker,date,publishedAt,source,title
GOOGL,2025-05-07,2025-05-07T21:00:00Z,Googleblog.com,Building delightful Android camera and media experiences
GOOGL,2025-05-07,2025-05-07T21:00:00Z,TechRadar,You can use the Google app to decode any eye-watering jargon you read on your iPhone – here’s how
GOOGL,2025-05-07,2025-05-07T21:00:00Z,Worldsoccertalk.com,How to watch Monterrey vs Toluca in the USA: Live Stream and TV for 2025 Liga MX Clausura Tournament
GOOGL,2025-05-07,2025-05-07T20:55:49Z,Business Insider,Verily CEO tells staff the sale of its insurance business is a 'strategic win' as the deal closes
GOOGL,2025-05-07,2025-05-07T20:52:59Z,The Verge,Google launched a Gemini app for iPad
GOOGL,2025-05-07,2025-05-07T20:52:53Z,Github.com,Show HN: Picostrap5 A free bootstrap-based WordPress theme on GitHub
GOOGL,2025-05-07,2025-05-07T20:52:46Z,Slashdot.org,Kashmir: India strikes unleash wave of misinformation online - BBC
GOOGL,2025-05-07,2025-05-07T20:49:35Z,Biztoc.com,Apple exec sends Google shares plunging as he calls AI the new search
GOOGL,2025-05-07,2025-05-07T20:43:45Z,redmondpie.com,Get Genuine Windows For Just $14 — Exclusive Deal At VIP-CDKDeals!
GOOGL,2025-05-07,2025-05-07T20:43:20Z,Theregister.com,Apple exec sends Google shares plunging as he calls AI the new search
GOOGL,2025-05-07,2025-05-07T20:43:13Z,Researchfor.me,Show HN: Tired of AI slop? here's a platform where humans help researchers
GOOGL,2025-05-07,2025-05-07T20:37:07Z,Bleeding Cool News,"The Bondsman Stunt Coordinator on Bees, Kevin Bacon/Stunts & More"
GOOGL,2025-05-07,2025-05-07T20:35:49Z,Macdailynews.com,"Apple Original Films unveils trailer for ‘Echo Valley,’ starring Julianne Moore and Sydney Sweeney"
GOOGL,2025-05-07,2025-05-07T20:33:45Z,Vox,Why grandparents are more important than ever
GOOGL,2025-05-07,2025-05-07T20:33:05Z,New York Post,Roosevelt Island Tram exec defends paying PR firm $170K in taxpayer cash to launch anti-tourist smear campaign
GOOGL,2025-05-07,2025-05-07T20:32:14Z,TechCrunch,"Rove, founded by a 22-year-old, is helping Gen Z earn airline miles without credit cards | TechCrunch"
GOOGL,2025-05-07,2025-05-07T20:32:07Z,Bleeding Cool News,Honey Don't!: First Trailer And Images For Ethan Coen's New Film
GOOGL,2025-05-07,2025-05-07T20:31:02Z,GSMArena.com,Honor Magic 7 Pro gets third Android 16 beta
GOOGL,2025-05-07,2025-05-07T20:30:25Z,Yanko Design,Bang & Olufsen A1 3rd Gen outshines other portable speakers both in design and performance
GOOGL,2025-05-07,2025-05-07T20:30:09Z,redmondpie.com,"The Tesla Model Y Just Got Cheaper In The United States, But There’s A Catch"
GOOGL,2025-05-07,2025-05-07T20:30:00Z,Forbes,Speeding AI With Co-Processors
GOOGL,2025-05-08,2025-05-08T23:46:08Z,Theregister.com,"Stop Pakistani content at the border, India tells media, tech biz"
GOOGL,2025-05-08,2025-05-08T23:37:08Z,Bleeding Cool News,"Doctor Odyssey: Our Season 1 Episode 17: ""The Wave (Part 1)"" Preview"
GOOGL,2025-05-08,2025-05-08T23:33:50Z,Decrypt,New Mistral AI Version Drops: A Worthy ChatGPT and Claude at a Fraction of the Cost
GOOGL,2025-05-08,2025-05-08T23:32:44Z,pymnts.com,CFPB Pulls Plug on Google Payment Oversight; Alphabet to Withdraw Lawsuit
GOOGL,2025-05-08,2025-05-08T23:28:47Z,9to5google.com,What’s new in Android’s May 2025 Google System Updates
GOOGL,2025-05-08,2025-05-08T23:20:31Z,Yahoo Entertainment,Alphabet Inc. (GOOGL): Among Billionaire Quants’ Two Sigma’s 10 Stock Picks with Huge Upside Potential
GOOGL,2025-05-08,2025-05-08T23:14:52Z,Forbes,Meta Quest+ Gets A Horizon+ Rebrand
GOOGL,2025-05-08,2025-05-08T23:14:25Z,Slashdot.org,Ex-model tearfully tells jury that Harvey Weinstein sexually assaulted her when she was 16 - AP News
GOOGL,2025-05-08,2025-05-08T23:11:29Z,Pypi.org,cirq-google 1.6.0.dev20250508231110
GOOGL,2025-05-08,2025-05-08T23:11:07Z,Bleeding Cool News,"SNL 50 Promos: Walton Goggins Faces ""The Role of a Lifetime"" & More"
GOOGL,2025-05-08,2025-05-08T23:10:00Z,Worldsoccertalk.com,How to watch Club Leon vs Cruz Azul in the USA: Live Stream and TV for 2025 Liga MX Clausura Tournament
GOOGL,2025-05-08,2025-05-08T23:07:07Z,Bleeding Cool News,"Ghosts Season 4 Finale: Our Updated S04E20 ""The Devil…"" Preview"
GOOGL,2025-05-08,2025-05-08T23:05:33Z,Esri.com,Add geotagged photos to your web map
GOOGL,2025-05-08,2025-05-08T23:05:30Z,Osnews.com,Google requires Android applications on Google Play to support 16 KB page sizes
GOOGL,2025-05-08,2025-05-08T23:02:39Z,pymnts.com,"OpenAI Targets Consumer Market, Expands Beyond AI Models"
GOOGL,2025-05-08,2025-05-08T23:02:22Z,The-ebook-reader.com,Onyx’s Massive 13.3″ Tab X C Now Available to Order on Amazon
GOOGL,2025-05-08,2025-05-08T23:00:19Z,XDA Developers,7 everyday tech headaches a home NAS easily solves
GOOGL,2025-05-08,2025-05-08T23:00:00Z,New Zealand Herald,‘Rip-off’: App developer and Consumer say fees will stifle open banking and create roadblocks for start-ups
GOOGL,2025-05-08,2025-05-08T23:00:00Z,Motley Fool Australia,3 ASX ETFs for beginner investors to buy
GOOGL,2025-05-08,2025-05-08T23:00:00Z,TechRadar,Apple will reportedly take on Ray-Ban Meta glasses in 2027
GOOGL,2025-05-08,2025-05-08T22:53:22Z,Slashdot.org,"Trump castigates Fed's Powell for not cutting rates, downplays inflation risk - Yahoo Finance"
GOOGL,2025-05-08,2025-05-08T22:50:07Z,Bleeding Cool News,The Lord of the Rings: The Hunt for Gollum Snags December 2027 Release
GOOGL,2025-05-08,2025-05-08T22:37:07Z,Bleeding Cool News,X-Men: Jake Schreier Is Reportedly In Early Talks To Direct
GOOGL,2025-05-08,2025-05-08T22:33:30Z,Techdirt,DOGE Aide Who Helped Gut CFPB Was Warned About Potential Conflicts Of Interest
GOOGL,2025-05-08,2025-05-08T22:33:09Z,Troyhunt.com,After the Breach: Finding new Partners with Solutions for Have I Been Pwned Users
GOOGL,2025-05-08,2025-05-08T22:31:18Z,CleanTechnica,AcePower Launches New 50 kW Air-Cooled High-Efficiency Module to Accelerate Europe’s Fast-Charging Network Expansion
GOOGL,2025-05-08,2025-05-08T22:30:35Z,The BMJ,Assessment of the impact of multi-cancer early detection test screening intervals on late-stage cancer at diagnosis and mortality using a state-transition model
GOOGL,2025-05-08,2025-05-08T22:28:16Z,TheWrap,How YouTube’s New AI Tool More Directly Connects Brands and Creators to Drive Ad Sales
GOOGL,2025-05-08,2025-05-08T22:23:26Z,Speckyboy.com,How to Use AI to Enhance Your WordPress Blog
GOOGL,2025-05-08,2025-05-08T22:18:48Z,Tubefilter,"At Google’s NewFronts pitch, execs explain how YouTube helps brands find “the perfect match”"
GOOGL,2025-05-08,2025-05-08T22:17:07Z,Bleeding Cool News,World of Tanks Modern Armor Announces New Valhalla Event
GOOGL,2025-05-08,2025-05-08T22:14:25Z,Android Police,Google Play will come with strict memory rules starting in November
GOOGL,2025-05-08,2025-05-08T22:14:07Z,PhoneArena,An alternative to Android and iOS is no longer optional
GOOGL,2025-05-08,2025-05-08T22:13:52Z,The Mac Observer,Google Maps on iPhone Now Saves Locations with Gemini
GOOGL,2025-05-08,2025-05-08T22:12:07Z,Bleeding Cool News,"60th ACM Awards Viewing Guide: Nominees, Performers & Much More!"
GOOGL,2025-05-08,2025-05-08T22:11:07Z,Bleeding Cool News,Spider-Man: Brand New Day – Liza Colón-Zayas Joins The Cast
GOOGL,2025-05-08,2025-05-08T22:06:55Z,Pypi.org,pulumi-gcp 8.30.0a1746738156
GOOGL,2025-05-08,2025-05-08T22:06:04Z,9to5Toys,"Get a more advanced and thorough cleaning with roborock’s Qrevo Curv robot vac & mop down at $1,100 low (Reg. $1,600)"
GOOGL,2025-05-08,2025-05-08T22:05:44Z,Idownloadblog.com,Google Maps can save locations found on your screenshots in a dedicated list
GOOGL,2025-05-08,2025-05-08T22:01:20Z,XDA Developers,5 single-purpose containers that run better on a Raspberry Pi than on a full server
GOOGL,2025-05-08,2025-05-08T22:00:59Z,9to5Toys,Amazon’s Fire TV Cube combines streaming needs with an Alexa smart speaker at a new $95 low (Reg. $140)
GOOGL,2025-05-08,2025-05-08T22:00:10Z,Android Police,"The Moto G Stylus 2025 just launched, and you can now get one at a 50% off"
GOOGL,2025-05-08,2025-05-08T22:00:00Z,Slashdot.org,Cloudflare CEO: AI Is Killing the Business Model of the Web
GOOGL,2025-05-08,2025-05-08T21:59:32Z,Mactrast.com,Google Says Apple VP’s Claim of Safari Search Traffic Decline is Incorrect
GOOGL,2025-05-08,2025-05-08T21:58:56Z,New York Post,"Spoil your cool mom with the No. 1 bestselling AC on Amazon, on sale now"
GOOGL,2025-05-08,2025-05-08T21:53:01Z,Slashdot.org,New Pope Elected: Robert Prevost Named First American Pontiff in History - Rolling Stone
GOOGL,2025-05-08,2025-05-08T21:47:07Z,Bleeding Cool News,Evil Dead Returns To Theaters With New Sequel In July 2026
GOOGL,2025-05-08,2025-05-08T21:47:00Z,Washingtontechnology.com,"Adobe, GSA ink access and discount software pact"
GOOGL,2025-05-08,2025-05-08T21:45:43Z,NBC News,Child exploitation watchdog says Meta encryption led to sharp decrease in tips and reports
GOOGL,2025-05-08,2025-05-08T21:44:29Z,Financial Post,U.S. and Canadian Trade War Goes Full Contact: Zone·ify Presents a TNA Produced Wrestling Event “The Border Brawl”– Where Diplomacy Ends and Body Slams Begin
GOOGL,2025-05-08,2025-05-08T21:42:08Z,Bleeding Cool News,Alien: Rogue Incursion Announces Part One: Evolved Edition
GOOGL,2025-05-08,2025-05-08T21:39:14Z,Biztoc.com,"Update turns Google Gemini into a prude, breaking apps for trauma survivors"
GOOGL,2025-05-08,2025-05-08T21:38:43Z,Android Authority,Your doorbell cam might have just picked up Google Home support
GOOGL,2025-05-08,2025-05-08T21:38:39Z,TechCrunch,"Microsoft employees are banned from using DeepSeek app, president says  | TechCrunch"
GOOGL,2025-05-08,2025-05-08T21:37:05Z,Bleeding Cool News,"Georgie & Mandy's: Revord on Missy's Post-""Young Sheldon"" Struggles"
GOOGL,2025-05-08,2025-05-08T21:36:04Z,Slate Magazine,Trump Thinks an Iran Deal Will Be His New Russia Deal. Fat Chance.
GOOGL,2025-05-08,2025-05-08T21:35:03Z,Trendhunter.com,Dedicated AI Tablet Applications - Google Launched a Gemini App Tailored for iPad Devices (TrendHunter.com)
GOOGL,2025-05-08,2025-05-08T21:33:26Z,Android Headlines,Galaxy Watch could get battery protection feature; here’s what it does
GOOGL,2025-05-08,2025-05-08T21:33:10Z,Theregister.com,"Update turns Google Gemini into a prude, breaking apps for trauma survivors"
GOOGL,2025-05-08,2025-05-08T21:30:21Z,Yanko Design,"This 67,000-Brick LEGO Vatican City Replica Looks So Real, You Could Hold A Conclave In It"
GOOGL,2025-05-08,2025-05-08T21:26:35Z,Digiday,"Q1 was a win for The Trade Desk, but bigger tests lie ahead"
GOOGL,2025-05-08,2025-05-08T21:24:11Z,9to5Toys,This EGO 56V 21-inch cordless self-propelled touch drive mower kit with 6.0Ah and 4.0Ah batteries hits a new $550 low
GOOGL,2025-05-08,2025-05-08T21:21:30Z,Forbes,"Netflix New Scroll, Meta AI's Game Changers, Neuralink Valued At $8.5 Billion"
GOOGL,2025-05-08,2025-05-08T21:20:10Z,Yahoo Entertainment,Here's one Biden crusade Trump is still on board with
GOOGL,2025-05-08,2025-05-08T21:15:17Z,Idownloadblog.com,Apple’s first smart glasses could arrive in the next two years
GOOGL,2025-05-08,2025-05-08T21:14:00Z,Yahoo Entertainment,"Addressing Vulnerabilities: Chainguard CPO & Co-Founder Kim Lewandowski, Live at RSAC 2025"
GOOGL,2025-05-08,2025-05-08T21:11:16Z,Reader's Digest,"This Hidden Smartphone Feature Could Prevent Thousands of Car Crashes, Yet 85% of People Don’t Know How to Use It"
GOOGL,2025-05-08,2025-05-08T21:10:03Z,PhoneArena,Metro by T-Mobile offers customers the option to lower monthly bills by 30%
GOOGL,2025-05-08,2025-05-08T21:07:37Z,Android Authority,Google is giving the Search bar on your phone a much-needed facelift
GOOGL,2025-05-08,2025-05-08T21:06:19Z,Biztoc.com,Apple Has 20 Billion Reasons to Talk Down Google Search
GOOGL,2025-05-08,2025-05-08T21:05:56Z,Boredpanda.com,“We Can’t Unsee”: Robert Irving Reveals How His Family Reacted To Racy Underwear Photoshoot
GOOGL,2025-05-08,2025-05-08T21:05:26Z,Mediaite,Tara Palmeri Busts MAGA Convert Lindi Li With Real Time Fact-Check Of Verbal Abuse Claim
GOOGL,2025-05-08,2025-05-08T21:04:29Z,Red-gate.com,Real-time Data Streaming in Snowflake
GOOGL,2025-05-08,2025-05-08T21:04:08Z,Bleeding Cool News,"All-Star Superman: Morrison, Quitely Audiobook Adapt Set for June"
GOOGL,2025-05-08,2025-05-08T21:01:46Z,Ozbargain.com.au,[Optus] Google Pixel 8a $5/ Month over life of plan
GOOGL,2025-05-08,2025-05-08T21:00:00Z,Dzone.com,Mastering Advanced Traffic Management in Multi-Cloud Kubernetes: Scaling With Multiple Istio Ingress Gateways
GOOGL,2025-05-08,2025-05-08T21:00:00Z,Worldsoccertalk.com,How to watch Necaxa vs Tigres UANL in the USA: Live Stream and TV for 2025 Liga MX Clausura Tournament
GOOGL,2025-05-08,2025-05-08T21:00:00Z,Anime News Network,Goblin Slayer II and BrownDust2 Join Forces for a Fantastical Seasonal Update
GOOGL,2025-05-08,2025-05-08T21:00:00Z,Wattsupwiththat.com,Google Accused of Greenwashing Massive AI Energy Consumption
GOOGL,2025-05-08,2025-05-08T21:00:00Z,Rivals.com,"M Exclusive: David Cone talks Moore suspension, Underwood, and more"
GOOGL,2025-05-08,2025-05-08T20:59:43Z,Forbes,Google Starts Scanning Screenshots For Location Data—You Must Now Decide
GOOGL,2025-05-08,2025-05-08T20:57:59Z,Reason,The App Store Freedom Act Compromises User Privacy To Punish Big Tech
GOOGL,2025-05-08,2025-05-08T20:57:08Z,Bleeding Cool News,Jonathan Hickman Confirms Ultimate Universe Was Meant For Donny Cates
GOOGL,2025-05-08,2025-05-08T20:55:15Z,Slashdot.org,'Habemus papum': Here's what happens immediately after a new pope is chosen - ABC News
GOOGL,2025-05-08,2025-05-08T20:55:04Z,Slashdot.org,"An Apple executive sparked a Google stock selloff. Don’t panic, analyst says - qz.com"
GOOGL,2025-05-08,2025-05-08T20:54:03Z,TechCrunch,Aurora co-founder Sterling Anderson is leaving the self-driving truck startup | TechCrunch
GOOGL,2025-05-08,2025-05-08T20:52:07Z,Bleeding Cool News,Relive the Events of Iron Man 2 with LEGO's Newest Mini Set
GOOGL,2025-05-08,2025-05-08T20:51:11Z,Smashingapps.com,"Deep Dive with Google Maps, Bing Maps & Their Beyond Features"
GOOGL,2025-05-08,2025-05-08T20:46:35Z,Pypi.org,google-cloud-storagebatchoperations 0.1.2
GOOGL,2025-05-08,2025-05-08T20:46:32Z,Pypi.org,google-cloud-storage-control 1.4.0
GOOGL,2025-05-08,2025-05-08T20:46:16Z,Pypi.org,google-cloud-managedkafka 0.1.10
GOOGL,2025-05-08,2025-05-08T20:46:07Z,Pypi.org,google-cloud-dataflow-client 0.9.0
GOOGL,2025-05-08,2025-05-08T20:46:00Z,CNET,Bring Luxury Luggage on Your Next Trip With Up to 40% Off Sitewide at Delsey Paris
GOOGL,2025-05-08,2025-05-08T20:45:45Z,Pypi.org,google-apps-chat 0.2.6
GOOGL,2025-05-08,2025-05-08T20:39:02Z,Boredpanda.com,Isla Fisher Posts Concerning Photo Amid Growing Tension With Sacha Baron Cohen Over $119 Million Divorce
GOOGL,2025-05-08,2025-05-08T20:38:56Z,9to5google.com,Gemini app moves 2.5 Flash and Pro into ‘preview’
GOOGL,2025-05-08,2025-05-08T20:36:46Z,Portableapps.com,Supermium Portable 132.0.6834.222 R3.01 (web browser with legacy support) Released
GOOGL,2025-05-08,2025-05-08T20:30:36Z,Hyperallergic,Required Reading
GOOGL,2025-05-08,2025-05-08T20:30:26Z,9to5Toys,Your PC’s Dream Team: MS Office & Windows 11 Pro for $55 (Reg. $418)
GOOGL,2025-05-09,2025-05-09T23:49:21Z,Biztoc.com,Apple and Google Search: A Complicated and Profitable Relationship
GOOGL,2025-05-09,2025-05-09T23:49:08Z,Biztoc.com,Google will pay Texas $1.4B to settle claims the company collected users’ data without permission
GOOGL,2025-05-09,2025-05-09T23:38:10Z,Boston Herald,Google will pay Texas $1.4B to settle claims the company collected users’ data without permission
GOOGL,2025-05-09,2025-05-09T23:37:07Z,Bleeding Cool News,WWE SmackDown Preview: Get Hyped Ahead of WWE Backlash
GOOGL,2025-05-09,2025-05-09T23:36:04Z,Yahoo Entertainment,Google will pay Texas $1.4B to settle claims the company collected users' data without permission
GOOGL,2025-05-09,2025-05-09T23:26:53Z,Biztoc.com,Google’s search antitrust trial is wrapping up—here’s what we learned
GOOGL,2025-05-09,2025-05-09T23:18:48Z,Austin American-Statesman,"Texas, Google reach $1.375 billion settlement over data privacy"
GOOGL,2025-05-09,2025-05-09T23:15:53Z,Biztoc.com,Google agrees to pay Texas $1.4 billion data privacy settlement
GOOGL,2025-05-09,2025-05-09T23:15:14Z,Slashdot.org,President Trump fires Librarian of Congress Carla Hayden - Federal News Network
GOOGL,2025-05-09,2025-05-09T23:14:43Z,Slashdot.org,‘Suits LA’ canceled ahead of Season One finale - New York Post
GOOGL,2025-05-09,2025-05-09T23:10:09Z,Android Headlines,Google Pixel Users Report Odd Camera Processing Issues
GOOGL,2025-05-09,2025-05-09T23:09:27Z,Phandroid - News for Android,The Best Budget Smartphones You can Get in 2025!
GOOGL,2025-05-09,2025-05-09T23:07:07Z,Bleeding Cool News,The Librarians: The Next Chapter Intros The Team; New Teaser Released
GOOGL,2025-05-09,2025-05-09T23:05:57Z,CNBC,Google agrees to pay $1.4 billion data privacy settlement to Texas
GOOGL,2025-05-09,2025-05-09T23:04:16Z,PhoneArena,Hotspot #30: The Android redesign is its best chance for a win
GOOGL,2025-05-09,2025-05-09T23:00:14Z,The Cut,The Professor Doing BDSM With Her Ex
GOOGL,2025-05-09,2025-05-09T22:55:21Z,Fox News,"Fox News True Crime Newsletter: Murdaugh family wedding, Karen Read trooper blooper, Bryan Kohberger's claims"
GOOGL,2025-05-09,2025-05-09T22:50:59Z,CNA,Texas secures $1.38 billion settlement with Google over data privacy
GOOGL,2025-05-09,2025-05-09T22:49:21Z,AOL,Texas says it secures $1.38 billion settlement with Google over data privacy
GOOGL,2025-05-09,2025-05-09T22:45:52Z,Android Authority,Forget Audio Overviews — NotebookLM’s next big feat could be generating Video Overviews
GOOGL,2025-05-09,2025-05-09T22:43:00Z,Snopes.com,"Video shows Russian drone striking Ukraine, not Indian drone intercepted by Pakistan"
GOOGL,2025-05-09,2025-05-09T22:38:55Z,Energycentral.com,The KJ Show #128 - Crazy Climate Strategies
GOOGL,2025-05-09,2025-05-09T22:37:07Z,Bleeding Cool News,AEW Collision Thursday Special Delivers Wrestling Excellence
GOOGL,2025-05-09,2025-05-09T22:35:55Z,Slashdot.org,"Google I/O 2025: What to expect, including updates to Gemini and Android 16 - TechCrunch"
GOOGL,2025-05-09,2025-05-09T22:33:43Z,HuffPost,Mexico Sues Google For Renaming Gulf Of Mexico As 'Gulf Of America'
GOOGL,2025-05-09,2025-05-09T22:26:07Z,Bleeding Cool News,Fire and Ice: When Hell Freezes Over #2 Preview: Body-Swap Shenanigans
GOOGL,2025-05-09,2025-05-09T22:20:02Z,Biztoc.com,Anthropic Says DOJ Proposal to Monitor Google’s AI Investments Would Harm Competition
GOOGL,2025-05-09,2025-05-09T22:17:47Z,9to5google.com,Google Keep web app finally rolling out text formatting
GOOGL,2025-05-09,2025-05-09T22:14:08Z,The Verge,Figma’s CEO on his new approach to AI
GOOGL,2025-05-09,2025-05-09T22:11:59Z,Android Headlines,The Hidden Cost of 'Free' AI: What You're Really Losing When You Ask ChatGPT
GOOGL,2025-05-09,2025-05-09T22:10:40Z,Ksolves.com,Salesforce Marketing Cloud - The Ultimate Guide | 2025
GOOGL,2025-05-09,2025-05-09T22:06:00Z,Theme Park Insider,How the Disney Abu Dhabi announcement came together
GOOGL,2025-05-09,2025-05-09T22:05:00Z,Thehillstimes.in,"Mumbai Metro 3: BKC-Worli services to start from May 10, final phase to open in August"
GOOGL,2025-05-09,2025-05-09T22:02:00Z,Slashdot.org,Coffee Shops Ditch WiFi and Laptops To Limit Remote Work
GOOGL,2025-05-09,2025-05-09T22:00:55Z,pymnts.com,AI Startups: AI Coding Tool Maker Anysphere Raises a Blockbuster $900 Million
GOOGL,2025-05-09,2025-05-09T22:00:00Z,Newser,Mexico Sues Google Over Gulf
GOOGL,2025-05-09,2025-05-09T22:00:00Z,Googleblog.com,"Google Workspace Updates Weekly Recap - May 9, 2025"
GOOGL,2025-05-09,2025-05-09T21:53:47Z,EFF,"How Signal, WhatsApp, Apple, and Google Handle Encrypted Chat Backups"
GOOGL,2025-05-09,2025-05-09T21:51:30Z,9to5Toys,"Bundle Jackery’s Explorer 1000 Plus with two 100W bifacial mini panels for $1,299, more"
GOOGL,2025-05-09,2025-05-09T21:44:00Z,The Portland Mercury,Plutonium is Forever... at State Capitol
GOOGL,2025-05-09,2025-05-09T21:39:10Z,Vox,"I pushed AI assistants to their limits, so you don’t have to. Here’s what really works."
GOOGL,2025-05-09,2025-05-09T21:37:07Z,Bleeding Cool News,Stick Official Trailer: Apple TV+ Previews Owen Wilson Golf Comedy
GOOGL,2025-05-09,2025-05-09T21:35:34Z,Slashdot.org,"Operation Sindoor: India to maintain escalation dominance, de-escalation rests on Pakistan - Firstpost"
GOOGL,2025-05-09,2025-05-09T21:34:53Z,Biztoc.com,"The Trade Desk CEO Slams Google, Amazon's 'Walled Gardens': 'Imagine What We Can Do In A Fair Market'"
GOOGL,2025-05-09,2025-05-09T21:33:36Z,Android Headlines,Samsung’s New Strategy: Hook Gen Z on Galaxy S25 AI Magic
GOOGL,2025-05-09,2025-05-09T21:30:10Z,Futurism,"Years After Promising to Stop Facial Recognition Work, Meta Has a Devious New Plan"
GOOGL,2025-05-09,2025-05-09T21:25:59Z,Whistleblowersblog.org,Calls Grow for Law Protecting AI Whistleblowers
GOOGL,2025-05-09,2025-05-09T21:25:49Z,Mental Floss,"Every State’s Favorite Fictional Mom, Mapped"
GOOGL,2025-05-09,2025-05-09T21:23:18Z,CBM (Comic Book Movie),Matt Reeves Still Attached To THE BATMAN PART II - But Could The Next BATMAN Movie Be WORLD'S FINEST?
GOOGL,2025-05-09,2025-05-09T21:23:06Z,GamesRadar+,Fortnite promises 20% back on V-bucks as long as you promise to give your money to Epic and not Apple
GOOGL,2025-05-09,2025-05-09T21:22:47Z,Computerworld,Surfshark study probes data hunger of web browsers
GOOGL,2025-05-09,2025-05-09T21:22:43Z,PCMag.com,Google's Chrome Browser Taps On-Device AI to Catch Tech Support Scams
GOOGL,2025-05-09,2025-05-09T21:22:43Z,PCMag.com,Google's Chrome Browser Taps On-Device AI to Catch Tech Support Scams
GOOGL,2025-05-09,2025-05-09T21:19:26Z,Android Police,Google argues Chrome would be 'insecure and obsolete' if broken up
GOOGL,2025-05-09,2025-05-09T21:08:30Z,pymnts.com,Anthropic Says DOJ Proposal to Monitor Google’s AI Investments Would Harm Competition
GOOGL,2025-05-09,2025-05-09T21:05:11Z,Japan Today,Mexico sues Google for labeling Gulf of Mexico as 'Gulf of America'
GOOGL,2025-05-09,2025-05-09T20:58:27Z,Boredpanda.com,Doctor On Vacation With Husband After He Left Toddler To Pass In Hot Car While He Played Video Game
GOOGL,2025-05-09,2025-05-09T20:56:53Z,The Verge,Indigenous scientists are fighting to protect their data — and their culture
GOOGL,2025-05-09,2025-05-09T20:56:35Z,9to5Toys,Get 360-degree audio with colorful flair for up to 18 hours through Anker’s Soundcore Glow portable speaker at $60
GOOGL,2025-05-09,2025-05-09T20:55:01Z,Android Central,Gemini Live is finally arriving on enterprise Google accounts for work and school
GOOGL,2025-05-09,2025-05-09T20:49:29Z,Al Jazeera English,"Mexico is suing Google over ‘Gulf of America’ label, Sheinbaum says"
GOOGL,2025-05-09,2025-05-09T20:41:10Z,Android Headlines,"Google’s Search empire is under fire, and Apple’s fanning the flames"
GOOGL,2025-05-09,2025-05-09T20:39:08Z,Biztoc.com,"Google I/O 2025: What to expect, including updates to Gemini and Android 16"
GOOGL,2025-05-09,2025-05-09T20:37:08Z,Bleeding Cool News,"Tracker Season 2 Finale: Want Another New ""Echo Ridge"" Sneak Peek?"
GOOGL,2025-05-09,2025-05-09T20:36:08Z,Gizmodo.com,"Arlo 2K Cameras with Night Vision Hit an All-Time Low Price, Now Cheaper Than Black Friday Deals"
GOOGL,2025-05-09,2025-05-09T20:35:54Z,Boredpanda.com,“Evil” Woman Faces Prison Time For Torturing Animals On Camera For Social Media Likes
GOOGL,2025-05-09,2025-05-09T20:35:15Z,TechCrunch,"Google I/O 2025: What to expect, including updates to Gemini and Android 16"
GOOGL,2025-05-09,2025-05-09T20:33:29Z,Vox,Americans have tuned out Gaza at the worst possible moment
GOOGL,2025-05-09,2025-05-09T20:32:32Z,PhoneArena,These dangerous Android apps are installed 2.5 million times each month
GOOGL,2025-05-09,2025-05-09T20:32:00Z,Digital Journal,Santosh Kumar Chennuri reshapes digital solutions and cloud adoption in the airline industry
GOOGL,2025-05-09,2025-05-09T20:28:42Z,Biztoc.com,"Google agrees to pay $50M to settle a lawsuit accusing it of systemic racial bias against Black employees, covering 4,000+ employees in California and New York"
GOOGL,2025-05-09,2025-05-09T20:22:10Z,Windows Central,"Sam Altman says ""I don't do Google searches anymore"" — but admits ChatGPT won't be Google's killer"
GOOGL,2025-05-09,2025-05-09T20:18:53Z,Macdailynews.com,Apple Music launches new ‘Viral Chart’ made up of top Shazam searches
GOOGL,2025-05-09,2025-05-09T20:17:13Z,NBC News,Fortnite applies to launch on Apple's App Store after Epic Games court win
GOOGL,2025-05-09,2025-05-09T20:17:09Z,Biztoc.com,"Google would need to shift up to 2,000 employees for remedies, search head says"
GOOGL,2025-05-09,2025-05-09T20:14:12Z,9to5Toys,"Heybike’s ALPHA all-terrain e-bike with the brand’s first mid-drive motor returns to $1,499 low in flash sale"
GOOGL,2025-05-09,2025-05-09T20:12:14Z,Slashdot.org,Recap: Here’s what happened in Google’s search antitrust trial
GOOGL,2025-05-09,2025-05-09T20:11:01Z,PC Gamer,"As Fortnite gears up for an App Store relaunch, Epic is cranking up its Rewards program to encourage people to use its payment system instead of Apple's"
GOOGL,2025-05-09,2025-05-09T20:09:39Z,9to5Toys,"Most affordable M4 iMac just hit the Amazon all-time low at $1,096 (Over $200 off)"
GOOGL,2025-05-09,2025-05-09T20:05:31Z,Android Central,Google calls the US Department of Justice's proposed antitrust remedies 'extreme'
GOOGL,2025-05-09,2025-05-09T20:01:34Z,PhoneArena,Google Messages just got a new feature you wish existed yesterday
GOOGL,2025-05-09,2025-05-09T20:00:19Z,Ambcrypto.com,Bitcoin beats Amazon to become the world’s 5th most valuable asset
GOOGL,2025-05-09,2025-05-09T20:00:13Z,New Scientist,AI hallucinations are getting worse – and they're here to stay
GOOGL,2025-05-09,2025-05-09T19:58:52Z,iPhone in Canada,Ecobee Smart Doorbell Camera Now Works with Google Home
